title,isbn10,isbn13,purchase_cost,shipping_cost,processing_cost,net_buying_cost
The Art of Being Human: The Humanities as a Technique for Living (10th Edition),0205022472,9780205022472,15.98,3.99,2,21.97
"Esperanto (the Universal Language): The Student's Complete Text Book; Containing Full Grammar, Exercises, Conversations, Commercial Letters, and Two Vocabularies (Classic Reprint)",1440082839,9781440082832,3.99,3.99,2,9.98
Milady's Aesthetician Series: Advanced Hair Removal,1401881742,9781401881740,34.95,0,2,36.95
The Psychology of Citizenship and Civic Engagement,0199752125,9780199752126,59.92,3.99,2,65.91
"Services Marketing: People, Technology, Strategy",1944659005,9781944659004,73.53,3.98,2,79.51
The Prince and the Pauper (Cliffs Notes),0822010968,0785555011144,1.99,3.99,2,7.98
Cengage Advantage Books: Ethics: Discovering Right and Wrong,0495502359,9780495502357,2.45,3.99,2,8.44
Sir Gawain and The Green Knight (Cliffs Notes),0822005158,0049086005158,0.01,3.99,2,6.0
An Introduction to Developmental Psychology,1405186526,9781405186520,13.73,3.99,2,19.72
An Introduction to Evolutionary Ethics,1405193964,9781405193962,22.47,3.99,2,28.46
Knowledge of Meaning: An Introduction to Semantic Theory,0262621002,9780262621007,27.0,6.2,2,35.2
Essentials of Symbolic Logic,1551118939,9781551118932,28.9,4.59,2,35.49
Teacher's Handbook: Contextualized Language Instruction (World Languages),1305109708,9781305109704,106.62,3.99,2,112.61
Kumon Algebra Workbook II (Kumon Math Workbooks),1935800868,9781935800866,9.91,4.89,2,16.8
Advanced Analysis of Motor Development,0736073930,9780736073936,7.5,3.99,2,13.49
An Introduction to Philosophical Logic,0631199829,9780631199823,21.6,5.99,2,29.59
The Salon Professional's Guide to Foot Care,1562533320,9781562533328,70.94,3.99,2,76.93
"World English Book 1, Student Book (World English, Second Edition: Real People Real Places Real Language)",1305089545,9781305089549,37.68,3.99,2,43.67
Nail Structure and Product Chemistry,140186709X,9781401867096,137.15,3.95,2,143.1
Glencoe Keyboarding Connections Projects and Applications: Teachers Resource Guide,0078600413,9780078600418,15.82,3.99,2,21.81
Big Data and Health Analytics,1482229234,9781482229233,66.92,0,2,68.92
The Art of Questioning: An Introduction to Critical Thinking,0130936995,9780130936998,34.11,3.99,2,40.1
Tonality and Design in Music Theory: Workbook,0130811297,9780130811295,35.62,3.99,2,41.61
Set Theory and Its Philosophy: A Critical Introduction,0199270414,9780199270415,18.23,3.99,2,24.22
Dyadic Developmental Psychotherapy: Essential Practices and Methods,0765707934,9780765707932,55.87,3.52,2,61.39
"Computer Network Time Synchronization: The Network Time Protocol on Earth and in Space, Second Edition",1439814635,9781439814635,171.64,6.84,2,180.48
"Modal Logics and Philosophy, Second Edition",0773536531,9780773536531,21.78,0,2,23.78
"Digital Filters: Analysis, Design and Applications",007002121X,9780070021211,26.57,3.99,2,32.56
Wie geht's? (World Languages),1285733606,9781285733609,80.98,0,2,82.98
Cognition In Children (Developmental Psychology: A Modular Course),0863778259,9780863778254,1.73,3.99,2,7.72
Aristotelian Logic (Literature),0791406903,9780791406908,22.5,3.98,2,28.48
The Purposeful Argument: A Practical Guide,1285438051,9781285438054,5.0,3.99,2,10.99
Exam Essentials: Cambridge Advanced Practice Tests 2 w/key + DVD-ROM,1285745078,9781285745077,14.35,0,2,16.35
Workbook/Lab Manual (Manual de actividades) Volume 2 for Sol y viento,0077397789,9780077397784,18.0,0,2,20.0
Understanding Hospital Billing and Coding:  A Comprehensive Presentation of Billing and Coding in the Hospital Environment,1416001719,9781416001713,2.59,3.99,2,8.58
"Recursion Theory, Godel's Theorems, Set Theory, Model Theory (Mathematical Logic: A Course With Exercises, Part II)",0198500505,9780198500506,44.69,3.99,2,50.68
PRENTICE HALL MATH COURSE 1 PRACTICE WORKBOOK 2004 C,0130377007,9780130377005,3.0,3.99,2,8.99
The Cambridge Companion to Vygotsky,0521537878,9780521537872,14.36,6.47,2,22.83
Security+ Guide to Networking Security Fundamentals,0619215666,9780619215668,0.25,4.89,2,7.14
Adolescence and Adulthood: Transitions and Transformations (Palgrave Insights in Psychology Series),0230296408,9780230296404,1.99,3.99,2,7.98
"Logical Self-Defense (Key Titles in Rhetoric, Argumentation, and Debates Series)",1932716181,9781932716184,7.44,3.98,2,13.42
"Young Minds in Social Worlds: Experience, Meaning, and Memory",0674034864,9780674034860,17.45,3.99,2,23.44
"Living Language English, Essential Edition (ESL/ELL): Beginner course, including coursebook, 3 audio CDs, and free online learning",030797233X,9780307972330,13.16,0,2,15.16
Readings on Argumentation,1891136208,9781891136207,10.05,3.99,2,16.04
¡En español!: Más práctica cuaderno (Workbook) with Lesson Review Bookmarks Level 3 (Spanish Edition),061866145X,9780618661459,11.04,3.99,2,17.03
"Digital Image Processing and Analysis: Human and Computer Vision Applications with CVIPtools, Second Edition",143980205X,9781439802052,32.76,0,2,34.76
Cambridge Checkpoint Science Workbook 3,1444183508,9781444183504,10.06,3.99,2,16.05
Machining Fundamentals Workbook,1619602148,9781619602144,20.81,3.99,2,26.8
"Introduction to Logic: Propositional Logic, Revised Edition (3rd Edition)",0130258490,9780130258496,15.89,3.99,2,21.88
Memory in Mind and Culture,0521758920,9780521758925,20.83,3.99,2,26.82
Understanding Other Minds: Perspectives from developmental social neuroscience,0199692971,9780199692972,53.49,3.98,2,59.47
Network Intrusion Detection (3rd Edition),0735712654,9780735712652,12.0,4.89,2,18.89
Packet Tracer Network Simulator (Professional Expertise Distilled),1782170421,9781782170426,20.09,3.99,2,26.08
Guide to Reliable Distributed Systems: Building High-Assurance Applications and Cloud-Hosted Services (Texts in Computer Science),1447124154,9781447124153,50.0,3.99,2,55.99
Real World Treatment Planning (Mental Health Practice),0534596797,9780534596798,25.02,3.94,2,30.96
Control Techniques for Complex Networks,0521884411,9780521884419,34.29,3.99,2,40.28
Theories of Human Development,0805847022,9780805847024,16.5,3.99,2,22.49
Handbook of Deontic Logic and Normative Systems,1848901321,9781848901322,22.13,3.99,2,28.12
GMAT Premier 2017 with 6 Practice Tests: Online + Book + Videos + Mobile (Kaplan Test Prep),1506203213,9781506203218,3.32,3.99,2,9.31
Psychoanalytic Theories: Perspective from Developmental Psychopathology (Whurr Series in Psychoanalysis),0415934885,9780415934886,38.99,3.99,2,44.98
Very First Reading: Big Phonics Workbook (1.0 Very First Reading),1409545997,9781409545996,2.95,3.99,2,8.94
Identity Development: Adolescence Through Adulthood,0761929592,9780761929598,89.0,3.99,2,94.99
Adaptive Origins: Evolution and Human Development,0805860126,9780805860122,14.99,3.99,2,20.98
Research Methods in Political Science (with MicroCase Printed Access Card),1133309305,9781133309307,15.17,3.99,2,21.16
GRE Premier 2017 with 6 Practice Tests: Online + Book + Videos + Mobile (Kaplan Test Prep),1506203221,9781506203225,1.22,3.99,2,7.21
Culture and Human Development,0761956840,9780761956846,2.28,3.98,2,8.26
The Oxford Handbook of Music Psychology (Oxford Library of Psychology),019872294X,9780198722946,175.0,3.99,2,180.99
Lev Vygotsky (Classic Edition): Revolutionary Scientist (Psychology Press & Routledge Classic Editions),1848726805,9781848726802,N/A,N/A,N/A,N/A
Essential Social Psychology (Sage Edge),1446270777,9781446270776,25.33,3.99,2,31.32
Electrical Theory DC Interactive DVD (1-4),1439059888,9781439059883,128.99,3.99,2,134.98
Godel's Incompleteness Theorems (Oxford Logic Guides),0195046722,9780195046724,64.75,3.99,2,70.74
"Designing and Supporting Computer Networks, CCNA Discovery Learning Guide",1587132125,0619472132128,4.75,3.99,2,10.74
"Understanding Virtual Reality: Interface, Application, and Design (The Morgan Kaufmann Series in Computer Graphics)",1558603530,9781558603530,2.73,3.97,2,8.7
Network Design Cookbook: Architecting Cisco Networks,1257750240,9781257750245,31.22,3.99,2,37.21
"Electrical Installation Calculations: Advanced, 8th ed",0415810035,8601300262918,20.14,3.99,2,26.13
Electrical Construction and Maintenance Techniques,0132471566,9780132471565,120.0,0,2,122.0
Industrial Electronics,0023730234,9780023730238,31.5,3.98,2,37.48
Heritage Tourism,0415595835,9780415595834,27.85,3.99,2,33.84
"Tools for Structured and Object-Oriented Design: An Introduction to Programming Logic, Sixth Edition",0130494984,9780130494986,0.25,4.89,2,7.14
Strategic Hospitality Human Resources Management,0135087058,9780135087053,70.0,3.99,2,75.99
Technology Strategies for the Hospitality Industry (2nd Edition),0135038022,9780135038024,20.74,3.98,2,26.72
"Introduction to Revenue Management for the Hospitality Industry: Principles and Practices for the Real World, An",0131885898,9780131885899,25.69,4.89,2,32.58
The Electricians Green Handbook (Go Green with Renewable Energy Resources),1111129800,9781111129804,15.84,3.99,2,21.83
Sustainability in the Hospitality Industry: Principles of sustainable operations,113891536X,9781138915367,51.91,3.95,2,57.86
"Principles of Food Preparation, Laboratory Manual (2nd Edition)",0023393505,9780023393501,98.93,3.99,2,104.92
When Children Refuse School: A Cognitive-Behavioral Therapy Approach Parent Workbook (Treatments That Work),0195308298,9780195308297,14.83,3.99,2,20.82
Guide to Telecommunications Cable Splicing,1428360913,9781428360914,194.92,0,2,196.92
Identity: Sociological Perspectives,0745654169,9780745654164,7.55,3.99,2,13.54
Study Guide to accompany Baking and Pastry: Mastering the Art and Craft,111871282X,9781118712825,29.83,3.99,2,35.82
DEWALT Electrical Code Reference: Based on the 2011 National Electrical Code (DEWALT Series),1111545480,9781111545482,10.78,4.49,2,17.27
Social Beings: Core Motives in Social Psychology,0470129115,9780470129111,10.49,3.99,2,16.48
"Carpentry Level 1 Trainee Guide, Paperback (5th Edition)",0133402371,9780133402377,68.92,5.54,2,76.46
Human Groups and Social Categories: Studies in Social Psychology,0521280737,9780521280730,37.24,3.99,2,43.23
Exploratory Factor Analysis (Understanding Statistics),0199734178,9780199734177,31.16,3.99,2,37.15
Hurting the One You Love: Violence in Relationships,0534633161,9780534633165,9.97,0,2,11.97
Construction Scheduling: Principles and Practices,0131133373,9780131133372,65.0,0,2,67.0
Customer Service in Tourism and Hospitality,1908999349,9781908999344,13.76,5.11,2,20.87
The Social Psychology of Organizing (Topics in Social Psychology Series),0075548089,9780075548089,32.46,3.99,2,38.45
"Construction Law for Design Professionals, Construction Managers and Contractors (MindTap Course List)",1111986908,9781111986902,48.38,3.99,2,54.37
Applied Social Psychology: Understanding and Addressing Social and Practical Problems,1483369730,9781483369730,N/A,N/A,N/A,N/A
Supervision in the Hospitality Industry,1118071786,9781118071786,0.99,3.99,2,6.98
Marketing in Leisure and Tourism: Reaching New Heights,1892132656,9781892132659,19.82,6.24,2,28.06
The Guitar and the New World: A Fugitive History (SUNY series in Italian/American Culture),1438446160,9781438446165,18.92,3.99,2,24.91
"Running on Empty: The Rise and Fall of Southampton College, 1963–2005",1438446969,9781438446967,27.95,0,2,29.95
Introduction to Logic and to the Methodology of the Deductive Sciences (Oxford Logic Guides),019504472X,9780195044720,7.52,5.59,2,15.11
Readings for Logical Analysis (Second Edition),0393972143,9780393972146,15.25,3.99,2,21.24
Logical Forms: An Introduction to Philosophical Logic,0631216790,9780631216797,28.95,5.99,2,36.94
Simplified Engineering for Architects and Builders,0470436271,9780470436271,39.98,5.37,2,47.35
The Philosophy of Mathematics (Oxford Readings in Philosophy),0198751206,9780198751205,6.74,4.99,2,13.73
"Pavement Engineering: Principles and Practice, Third Edition",1498758800,0001498758800,N/A,N/A,N/A,N/A
Human Resources Management in the Hospitality Industry,0470084804,9780470084809,4.44,3.99,2,10.43
"LEED v4 BD&C Mock Exam: Questions, answers, and explanations: A must-have for the LEED AP BD+C Exam, green building LEED certification, and sustainability (LEED Exam Guide Series) (Volume 3)",161265021X,9781612650210,27.89,0,2,29.89
Log Construction Manual: The Ultimate Guide to Building Handcrafted Log Homes,0971573603,9780971573604,22.5,3.99,2,28.49
HVACR 101 (Enhance Your HVAC Skills!),141806663X,9781418066635,70.64,5.31,2,77.95
Introduction to Hydraulics & Hydrology: With Applications for Stormwater Management,1133691838,9781133691839,49.33,3.95,2,55.28
An Introduction to Metalogic,1554811716,9781554811717,32.33,6.3,2,40.63
The Psychology of Serial Killer Investigations: The Grisly Business Unit,0124042600,9780124042605,11.96,3.99,2,17.95
Materials and Components of Interior Architecture (8th Edition) (Fashion Series),0132769158,9780132769150,75.0,3.99,2,80.99
Understanding Genocide: The Social Psychology of the Holocaust,0195133625,9780195133622,36.46,0,2,38.46
Nanofluidics and Microfluidics: Systems and Applications (Micro and Nano Technologies),1437744699,9781437744699,174.49,3.99,2,180.48
Cengage Advantage Books: Conducting Research in Psychology: Measuring the Weight of Smoke,1133588050,9781133588054,33.44,3.99,2,39.43
What is this thing called Philosophy of Language?,0415517842,9780415517843,4.8,3.99,2,10.79
"Social Psychology and Human Nature, Brief",1133956408,9781133956402,7.37,3.95,2,13.32
Masonry Skills,1285426835,9781285426839,64.99,5.87,2,72.86
Elements of Deductive Inference: An Introduction to Symbolic Logic,0534551211,9780534551216,1.05,3.99,2,7.04
Mathematics and Scientific Representation (Oxford Studies in the Philosophy of Science),0190201398,9780190201395,47.24,6.18,2,55.42
Collected Works: Volume I: Publications 1929-1936 (Kurt Godel Collected Works),0195039645,9780195039641,40.0,3.75,2,45.75
"Missouri Then and Now, New and Enlarged Edition",0826213529,9780826213525,10.0,3.99,2,15.99
Literacy Instruction for Students who are Deaf and Hard of Hearing (Professional Perspectives On Deafness: Evidence and Applications),0199838550,9780199838554,35.0,3.99,2,40.99
Practical Problems in Mathematics for Carpenters (Practical Problems In Mathematics Series),1111313423,9781111313425,59.25,3.95,2,65.2
Introduction to Finite Element Analysis Using MATLAB and Abaqus,1466580208,9781466580206,90.0,3.99,2,95.99
Structural Proof Theory,0521068428,9780521068420,42.31,3.99,2,48.3
Modal Logic for Philosophers,1107609526,9781107609525,35.58,3.99,2,41.57
Logic: An Introduction,1889439142,9781889439143,15.83,3.99,2,21.82
"Nanotechnology: Understanding Small Systems, Second Edition (Mechanical and Aerospace Engineering Series)",143984920X,9781439849200,5.85,3.99,2,11.84
The Nature of Mathematical Knowledge,0195035410,9780195035414,17.49,4.93,2,24.42
Philosophical Logic: An Introduction to Advanced Topics,1441119116,9781441119117,15.95,3.99,2,21.94
"Ethics: History, Theory, and Contemporary Issues",0199797269,9780199797264,9.99,6.14,2,18.13
Landscapes of Minnesota: A Geography,0873515919,9780873515917,9.1,3.99,2,15.09
An Introduction to the Geography of Tourism,1442271086,9781442271081,51.34,3.99,2,57.33
"Addressing Cultural Complexities in Practice: Assessment, Diagnosis, and Therapy",1433802198,9781433802195,4.0,3.99,2,9.99
Languages and Dialects in the U.S.: Focus on Diversity and Linguistics,0415728606,9780415728607,20.5,3.99,2,26.49
Design of Mechanical and Electrical Systems in Buildings,0130972355,9780130972354,79.73,3.99,2,85.72
Inconsistent Geometry (Studies in Logic),1848900228,9781848900226,29.73,3.99,2,35.72
"Booker T. Washington and the Struggle against White Supremacy: The Southern Educational Tours, 1908-1912",0230621384,9780230621381,14.56,3.99,2,20.55
HVAC Level 2 Trainee Guide (4th Edition),0133404277,9780133404272,68.05,3.98,2,74.03
Pulsed Power Systems: Principles and Applications,3540261370,9783540261377,99.29,4.69,2,105.98
Portraits of Conflict: A Photographic History of Georgia in the Civil War,1557284210,9781557284211,24.77,3.99,2,30.76
Where the Earth and Sky Are Sewn Together: Sobaípuri-O’odham Contexts of Contact and Colonialism,1607810670,9781607810674,111.99,3.99,2,117.98
"Wittgenstein, Part II: Exegesis Â§Â§428-693: Mind and Will: Volume 4 of an Analytical Commentary on the Philosophical Investigations",0631219870,9780631219873,23.52,3.99,2,29.51
"Industrial Cowboys: Miller & Lux and the Transformation of the Far West, 1850-1920",0520245342,9780520245341,21.0,3.99,2,26.99
"Black Milwaukee: The Making of an Industrial Proletariat, 1915-45",0252074106,9780252074103,16.87,3.99,2,22.86
"Practical Guide to the Packaging of Electronics: Thermal and Mechanical Design and Analysis, Third Edition",1498753957,9781498753951,82.11,0,2,84.11
Programming PICs in BASIC: 8-Pin Projects - Volume 1,1449985750,9781449985752,10.66,3.99,2,16.65
Green Empire: The St. Joe Company and the Remaking of Florida's Panhandle,0813029511,9780813029511,6.99,0,2,8.99
A White-Collar Profession: African American Certified Public Accountants since 1921,0807853771,9780807853771,3.55,3.96,2,9.51
Dignity: Its Essential Role in Resolving Conflict,0300188056,9780300188059,8.02,4.49,2,14.51
Remembering the Kanji 1: A Complete Course on How Not to Forget the Meaning and Writing of Japanese Characters,0824835921,8601400140734,20.23,3.99,2,26.22
"Low Cost Flip Chip Technologies for DCA, WLCSP, and PBGA Assemblies",0071351418,0639785319634,58.94,0,2,60.94
Assistant Teacher(Passbooks) (Career Examination Passbooks),0837311187,9780837311180,53.0,3.99,2,58.99
"Golosa: A Basic Course in Russian, Book One (5th Edition)",0205741355,9780205741359,94.72,3.99,2,100.71
Dreaming of Dixie: How the South Was Created in American Popular Culture,146960986X,9781469609867,18.0,3.99,2,23.99
"Micromechatronics: Modeling, Analysis, and Design with MATLAB, Second Edition (Nano- and Microscience, Engineering, Technology and Medicine)",1420065629,9781420078299,33.1,0,2,35.1
Office Assistant C-1382 (Passbooks) (Career Examination Series),0837313821,9780837313825,29.94,0,2,31.94
Cambridge IELTS 7 Self-study Pack (Student's Book with Answers and Audio CDs (2)): Examination Papers from University of Cambridge ESOL Examinations (IELTS Practice Tests),0521739195,9780521739191,9.0,4.48,2,15.48
Steck-Vaughn Think Alongs: Student Workbook   (Level B),0739800841,9780739800843,1.0,3.96,2,6.96
Collage and Architecture,0415533279,9780415533270,10.45,3.99,2,16.44
Comparative Economics in a Transforming World Economy (The MIT Press),0262037335,9780262037334,93.73,3.99,2,99.72
McDougal Littell World History: Student Edition Grades 6 Ancient Civilizations 2006,0618531246,9780618531240,9.25,5.49,2,16.74
Color Planning for Interiors: An Integrated Approach to Color in Designed Spaces,0470135425,9780470135426,18.9,3.98,2,24.88
"Living Language English for Spanish Speakers, Essential Edition (ESL/ELL): Beginner course, including coursebook, 3 audio CDs, and free online learning",0307972607,9780307972606,15.66,3.99,2,21.65
Ethical Issues in Youth Work,0415499712,9780415499712,16.67,0,2,18.67
Do Not Disturb,0789201135,9780789201133,73.09,0,2,75.09
Programming 8-bit PIC Microcontrollers in C: with Interactive Hardware Simulation,0750689609,9780750689601,17.34,5.21,2,24.55
On the Genealogy of Morality,0872202836,9780872202832,3.49,4.49,2,9.98
Analog Circuits (World Class Designs),0750686278,9780750686273,24.38,5.55,2,31.93
"Shakespeare's Comedy of Errors, Love's Labour's Lost and the Two Gentlemen of Verona (Cliffs Notes)",0822000105,0049086000108,5.35,3.99,2,11.34
The Constant Fire: Beyond the Science vs. Religion Debate,0520265866,9780520265868,6.0,3.99,2,11.99
Transforming the Doctor's Office,0415840643,9780415840644,41.9,3.99,2,47.89
Presentation Strategies and Dialogue,1609011449,9781609011444,9.59,0,2,11.59
Learn Russian Language Through Dialogue: Bilingual Textbook with Parallel Translation for Speakers of English (English Edition) (Russian and English Edition),1469971577,9781469971575,18.91,5.64,2,26.55
Chinese Sculpture,0300100655,9780300100655,27.46,6.19,2,35.65
Design in Modular Construction,0415554500,9780415554503,95.04,3.99,2,101.03
Math 87 Adaptation: Student Workbook (Saxon Math 8/7),1565773004,9781565773004,34.95,4.95,2,41.9
Sterling Test Prep MCAT Practice Tests: Biological & Biochemical Foundations,0989292525,9780989292528,5.03,3.82,2,10.85
"Short Takes in Fiction: Critical Thinking, Reading and Writing",0201516772,9780201516777,2.29,3.99,2,8.28
Accessibility Pocket Book: 2009 IBC and ICC/ANSI A117.1 2003 (International Code Council Series),1580018645,9781580018647,72.37,4.82,2,79.19
The Fairchild Books Dictionary of Interior Design,1609015347,9781609015343,15.97,3.99,2,21.96
"Atmel AVR Microcontroller Primer: Programming and Interfacing, Second Edition (Synthesis Lectures on Digital Circuits and Systems)",160845861X,9781608458615,11.2,3.99,2,17.19
For Whom The Bell Tolls (Cliffs Notes),0822004976,0049086004977,4.05,1.0,2,7.05
Homer's Iliad (Cliffs Notes),0822006456,9780822006459,0.1,4.89,2,6.99
Study Guide to accompany Managerial Accounting for the Hospitality Industry,0470140550,9780470140550,10.0,3.98,2,15.98
Eliot's Silas Marner (Cliffs Notes),0822011921,0049086011920,0.01,3.99,2,6.0
"¡Buen viaje!, Level 1, TEXAS Student Edition (Glencoe Spanish)",007866361X,9780078663611,7.23,3.99,2,13.22
Schaum's Outline of Descriptive Geometry (Schaum's),0070272905,9780070272903,18.3,3.99,2,24.29
Parola Per Parola: New Advanced Italian Vocabulary (Italian Edition) (Italian and English Edition),1444110020,9781444110029,7.07,3.99,2,13.06
Schaum's Outline of Engineering Mechanics Dynamics (Schaum's Outlines),0071713603,9780071713603,2.5,4.49,2,8.99
The Good Earth (Cliffs Notes),0822005352,0049086005356,0.01,3.99,2,6.0
Integrated Korean: Advanced Intermediate 2 (KLEAR Textbooks in Korean Language),0824825268,9780824825263,4.46,3.98,2,10.44
Integrated Chinese: Level 2 Textbook: Traditional and Simplified Character Edition,0887274803,9780887274800,6.0,3.99,2,11.99
"The Arts of Intimacy: Christians, Jews, and Muslims in the Making of Castilian Culture",0300142145,9780300142143,6.68,3.99,2,12.67
Beginner's Persian (Iranian Persian Farsi) with 2 Audio CDs (Hippocrene Beginner's),0781812747,9780781812740,16.61,3.99,2,22.6
Nuevos mundos: Curso de espanol para bilingues,0470588985,9780470588987,59.17,3.99,2,65.16
"Health, Sustainability and the Built Environment",1563675250,9781563675256,3.32,3.98,2,9.3
Study Guide for The Codes Guidebook for Interiors,1118809416,9781118809419,25.38,3.99,2,31.37
Puntos (Student Edition) Standalone Book,0073534498,9780073534497,85.0,3.99,2,90.99
Kaplan SAT Math Workbook,1419541862,9781419541865,1.99,3.99,2,7.98
Tino Zervudachi: A Portfolio,0983388962,9780983388968,29.8,3.99,2,35.79
Novel Interiors: Living in Enchanted Rooms Inspired by Literature,0385345992,9780385345996,13.99,5.82,2,21.81
REALIDADES 2014 LEVELED VOCABULARY AND GRAMMAR WORKBOOK LEVEL 3,0133225739,9780133225730,12.7,27.99,2,42.69
Studio Companion Series Presentation Basics,1609011015,9781609011017,17.21,3.99,2,23.2
Global Perspectives for Cambridge IGCSE,0198395140,9780198395140,17.82,3.99,2,23.81
"15 Real, Recent LSATs: Manhattan LSAT Practice Book (Manhattan Lsat: Practice Books)",1937707121,9781937707125,6.55,3.99,2,12.54
Workbook,0131401637,9780131401631,37.32,3.99,2,43.31
Arabic for Life: A Textbook for Beginning Arabic,0300141319,9780300141313,42.25,4.99,2,49.24
"GMAT 2017 Strategies, Practice & Review with 2 Practice Tests: Online + Book (Kaplan Test Prep)",1506203191,9781506203195,3.74,3.99,2,9.73
Schaum's Easy Outline of Discrete Mathematics,0071398775,0639785380665,4.98,3.99,2,10.97
"The Red Pony, Chrysanthemums and Flight (Cliffs Notes)",0822011352,9780822011354,0.01,3.99,2,6.0
"Oxford Latin Course, Part II, Second Edition",0195212053,9780195212051,4.92,4.94,2,11.86
The Diary of Anne Frank (Cliffs Notes),0822003902,9780822003908,0.1,4.89,2,6.99
"The Rouledge Course in Modern Mandarin Chinese, Workbook Level 1: Simplified Characters",0415472520,9780415472524,11.24,3.99,2,17.23
Voila!: An Introduction to French (with Audio CD) (World Languages),1428231315,9781428231313,6.0,3.99,2,11.99
Russian: From Intermediate to Advanced,0415712270,9780415712279,49.0,3.99,2,54.99
Second Language Learning and Language Teaching: Fifth Edition,0415713803,9780415713801,14.58,3.99,2,20.57
Japanese for Busy People II: Revised 3rd Edition (Japanese for Busy People Series),1568363869,9781568363868,11.42,3.99,2,17.41
Ethics in Practice: An Anthology,0470671831,9780470671832,11.13,3.99,2,17.12
Classics of Political and Moral Philosophy,0199791155,9780199791156,27.48,3.99,2,33.47
Voces de Espana: Antologia literaria (Spanish Edition),0759396663,9780759396661,28.1,3.99,2,34.09
An Introduction to Language and Linguistics,1107637996,9781107637993,17.07,3.99,2,23.06
Electrical Theory: DC DVD Set (1-4),143548083X,9781435480834,99.89,3.99,2,105.88
Compressible Fluid Dynamics: With Personal Computer Applications/Book and Disk,013308552X,9780133085525,71.25,3.99,2,77.24
The Field Guide for Powerline Workers,1418014877,9781418014872,208.02,3.99,2,214.01
Networked Graphics: Building Networked Games and Virtual Environments,0123744237,9780123744234,57.27,3.99,2,63.26
Master Electrician’s Review: Based on the National Electrical Code 2011,1439059608,8580000873030,96.5,3.99,2,102.49
ManageFirst: Nutrition with Answer Sheet (2nd Edition),0132181630,9780132181631,11.11,3.99,2,17.1
"Software Application Development: A Visual C++, MFC, and STL Tutorial (Chapman & Hall/CRC Computer and Information Science Series)",1466511001,9781466511002,78.65,3.98,2,84.63
Cultural Heritage and Tourism: An Introduction (ASPECTS OF TOURISM),1845411765,9781845411763,16.58,3.99,2,22.57
