title,isbn10,isbn13,purchase_cost,shipping_cost,processing_cost,net_buying_cost
The Psychology of Attitudes and Attitude Change,141292975X,9781412929752,7.0,3.99,2,12.99
The Dynamics of Persuasion: Communication and Attitudes in the 21st Century (Routledge Communication Series),0805840885,9780805840889,1.17,3.99,2,7.16
BECOMING AWARE: A TEXT/WORKBOOK FOR HUMAN RELATIONS AND PERSONAL ADJUSTMENT,0757528821,9780757528828,3.73,3.99,2,9.72
The Creativity Crisis: Reinventing Science to Unleash Possibility,0199375380,9780199375387,5.87,3.98,2,11.85
Handbook of Experimental Existential Psychology,1593850409,9781593850401,24.95,0,2,26.95
Practical Heating Technology,141808039X,9781418080396,15.75,3.99,2,21.74
"Moral Dilemmas of Modern War: Torture, Assassination, and Blackmail in an Age of Asymmetric Conflict",0521685109,9780521685108,2.3,3.99,2,8.29
The American South: A History (Volume 2),074256097X,9780742560970,80.4,3.99,2,86.39
"Colegio Cesar Chavez, 1973-1983: A Chicano Struggle for Educational Self-Determination (Latino Communities: Emerging Voices - Political, Social, Cultural and Legal Issues)",0815336314,9780815336310,163.59,3.99,2,169.58
"Facility Piping Systems Handbook: For Industrial, Commercial, and Healthcare Facilities",0071597212,9780071597210,31.25,5.97,2,39.22
Modern Refrigeration and Air Conditioning,1566377242,9781566377249,6.52,13.74,2,22.26
Thermal Environmental Engineering (3rd Edition),0139172203,9780139172205,116.01,3.99,2,122.0
Ethics and the Practice of Architecture,0471298220,9780471298229,12.77,3.99,2,18.76
"Engendering Whiteness: White Women and Colonialism in Barbados and North Carolina, 1627-1865 (Studies in Imperialism)",0719064325,9780719064326,56.94,3.99,2,62.93
A Companion to Bioethics,1444350846,9781444350845,19.95,3.99,2,25.94
CliffsNotes on Canterbury Tales,0822002922,9780822002925,0.01,3.99,2,6.0
Foundations of Ethics: An Anthology,1405129522,9781405129527,18.44,5.47,2,25.91
"Energy Audit of Building Systems: An Engineering Approach, Second Edition (Mechanical and Aerospace Engineering Series)",1439828717,9781439828717,64.3,3.99,2,70.29
Unfit for the Future: The Need for Moral Enhancement (Uehiro Series in Practical Ethics),0198707924,9780198707929,24.83,3.99,2,30.82
The Color Purple (Cliffs Notes),0822003082,9780822003083,0.1,4.89,2,6.99
Steel Structures: Controlling Behavior Through Design,0471584584,9780471584582,11.66,3.98,2,17.64
Jenseits von Gut und Böse/Beyond Good and Evil (German/English Bilingual Text) (German Edition),1909669237,9781909669239,9.81,3.98,2,15.79
Dependent Rational Animals: Why Human Beings Need the Virtues (The Paul Carus Lectures),081269452X,9780812694529,10.44,3.99,2,16.43
"ASE Test Preparation - Transit Bus H5, Suspension and Steering (Delmar Learning's Ase Test Prep Series)",1428340114,9781428340114,20.66,3.99,2,26.65
Disagreement (Key Concepts in Philosophy),0745672272,9780745672274,12.04,3.99,2,18.03
Applied Ethics: A Multicultural Approach,1612058396,9781612058399,23.25,4.98,2,30.23
"Queer Ecologies: Sex, Nature, Politics, Desire",0253222036,9780253222039,19.16,3.99,2,25.15
The Handbook of Communication Skills,0415359112,9780415359115,15.28,3.99,2,21.27
"The Psychology of Genocide, Massacres, and Extreme Violence: Why Normal People Come to Commit Atrocities (Praeger Security International)",0275990001,9780275990008,43.55,0,2,45.55
Pursuits of Wisdom: Six Ways of Life in Ancient Philosophy from Socrates to Plotinus,069115970X,9780691159706,12.95,3.99,2,18.94
Introduction to Political Psychology: 3rd Edition,1848726716,9781848726710,184.54,3.99,2,190.53
Inside the Illicit Economy: Reconstructing the Smugglers' Trade of Sixteenth Century Bristol,1409440192,9781409440192,65.0,4.49,2,71.49
Discourse and Social Psychology: Beyond Attitudes and Behaviour,0803980566,9780803980563,4.2,3.99,2,10.19
Administrative Clerk(Passbooks) (Career Examination Passbooks),0837320143,9780837320144,38.28,0,2,40.28
Human Ethology,0202309703,9780202309705,39.1,3.99,2,45.09
Social Psychology of Social Problems: The Intergroup Context,0230284752,9780230284753,49.98,0,2,51.98
I Know Why the Caged Bird Sings (Cliffs Notes),0822006413,0785555010376,1.76,3.99,2,7.75
"Attitudes: Their Structure, Function and Consequences (v. 1)",1841690104,9781841690100,21.56,3.99,2,27.55
Geomatics,013032289X,9780130322890,23.98,6.09,2,32.07
Computer Ethics: A Case-based Approach,0521709148,9780521709149,12.83,3.99,2,18.82
The Social Psychology of Power,1606236199,9781606236192,49.61,3.99,2,55.6
Schaum's Outline of Mathematics for Liberal Arts Majors (Schaum's Outlines),0071544291,9780071544290,4.14,3.99,2,10.13
Greek Classics (Cliffs Notes),0822005662,9780822005667,0.99,3.99,2,6.98
Against Academicians and the Teacher,0872202127,9780872202122,4.21,3.99,2,10.2
Black Boy (Cliffs Notes),0822002426,0049086002423,0.1,4.89,2,6.99
Moments Litteraires: An Anthology for Intermediate French (English and French Edition),0618527737,0046442527736,41.63,3.99,2,47.62
Making Connections Level 2 Student's Book: Skills and Strategies for Academic Reading,1107628741,8601200463347,12.85,3.99,2,18.84
Grammaire Progressive Du Francais - Nouvelle Edition: Livre Intermediaire 3e Edition + Cd-audio (Collec Progress) (French Edition),2090381248,9782090381245,18.2,3.99,2,24.19
Fluent English (ESL),1400006058,9781400006052,10.85,3.99,2,16.84
Toward a Global Idea of Race (Barrows Lectures),0816649200,9780816649204,17.89,0,2,19.89
Hawthorne's The Scarlet Letter (Cliffs Notes),0822011654,9780822011651,0.01,3.99,2,6.0
Viajes: Introduccion al espanol (World Languages),1133603653,9781133603658,23.8,3.99,2,29.79
Personnages: An Intermediate Course in French Language and Francophone Culture,0470432160,9780470432167,3.53,3.99,2,9.52
Dos mundos en breve Student Edition,0073213411,9780073213415,7.25,5.87,2,15.12
"Tecnologia de refrigeracion y aire acondicionado / Refrigeration and Air Conditioning Technology, Vol. 1 (Spanish Edition)",6074811415,9786074811414,348.95,3.99,2,354.94
Student Study Guide,0133988686,9780133988680,275.0,0,2,277.0
"Tecnologia de refrigeracion y aire acondicionado / Refrigeration and Air Conditioning Technology, Vol. 3 (Spanish Edition)",6074811431,9786074811438,51.43,5.55,2,58.98
"Power Tool Safety and Operation :Woodworking, Metalworking, Metalsand Welding",0913163309,9780913163306,11.15,0,2,13.15
Fundamentals of Structural Engineering,3319243292,9783319243290,67.0,5.5,2,74.5
Uso interactivo del vocabulario A1-B1 (Spanish Edition),8477119783,9788477119784,19.76,3.99,2,25.75
Blueprints and Plans for HVAC,142833520X,9781428335202,24.98,3.99,2,30.97
Manual de gramática: En espanol (World Languages),1133935591,9781133935599,92.5,3.99,2,98.49
Frege: An Introduction to the Founder of Modern Analytic Philosophy,0631222308,9780631222309,49.0,0,2,51.0
"Tecnologia de refrigeracion y aire acondicionado, Tomo 4 / Refrigeration and Air Conditioning Technology, Vol. 4 (Spanish Edition)",607481144X,9786074811445,50.36,5.47,2,57.83
Pedagogical Grammar,902721218X,9789027212184,34.73,3.99,2,40.72
Alter Ego + 1 : Cahier d'activités + CD audio (French Edition),2011558115,9782011558114,9.31,3.99,2,15.3
Grammar and Beyond Level 3 Student's Book,0521142989,9780521142984,13.7,3.99,2,19.69
Plants as Persons: A Philosophical Botany (SUNY series on Religion and the Environment),1438434286,9781438434285,28.49,0,2,30.49
600 Basic Japanese Verbs: The Essential Reference Guide: Learn the Japanese Vocabulary and Grammar You Need to Learn Japanese and Master the JLPT,4805312378,9784805312377,12.5,3.99,2,18.49
Cambridge Grammar of English Hardback with CD-ROM: A Comprehensive Guide,0521857678,9780521857673,62.04,3.99,2,68.03
NATEF Correlated Task Sheets for Automotive Heating and Air Conditioning,0133515354,9780133515350,28.49,4.69,2,35.18
BTU Buddy Notebook,1435425839,9781435425835,61.95,0,2,63.95
Russian Grammar Workbook,1118273419,9781118273418,39.98,0,2,41.98
Refrigeration and Air Conditioning (3rd Edition),0133237753,9780133237757,9.99,3.99,2,15.98
The Ethics of the Global Environment (Edinburgh Studies in World Ethics),0748608958,9780748608959,1.6,6.47,2,10.07
An Introduction to Structural Optimization (Solid Mechanics and Its Applications),1402086652,9781402086656,58.6,3.98,2,64.58
"Intrigue: langue, culture et mystère dans le monde francophone (3rd Edition)",0205741320,9780205741328,8.96,5.34,2,16.3
Modern Hydronic Heating: For Residential and Light Commercial Buildings,0766816370,9780766816374,40.25,3.99,2,46.24
Well-Being for Public Policy (Oxford Positive Psychology Series),0195334078,9780195334074,8.78,0,2,10.78
Urdu: An Essential Grammar (Routledge Essential Grammars),0415163811,9780415163811,9.04,5.48,2,16.52
"Generative Emergence: A New Discipline of Organizational, Entrepreneurial, and Social Innovation",0199933596,9780199933594,85.54,3.99,2,91.53
Change of Heart: What Psychology Can Teach Us About Spreading Social Change,159056233X,9781590562338,2.04,3.99,2,8.03
Oxford Picture Dictionary (Monolingual English),0194369765,9780194369763,2.28,5.44,2,9.72
CliffsNotes Roman Classics,0822011522,9780822011521,0.9,3.99,2,6.89
Teach Yourself Mandarin Chinese Complete Course Package (Book + 2CDs) (Teach Yourself . . . Complete Courses),0071430334,0639785386582,11.71,3.99,2,17.7
Multiculturalism and Diversity: A Social Psychological Perspective,1405190655,9781405190657,19.68,3.99,2,25.67
"Foundations for Teaching English Language Learners: Research, Theory, Policy, and Practice",1934000019,9781934000014,6.31,3.99,2,12.3
Handbook of Social Psychology: Volume Two,0470137495,9780470137499,12.54,3.99,2,18.53
Community Psychology: A Common Sense Approach to Mental Health,013083341X,9780130833419,1.8,3.99,2,7.79
The Routledge Introductory Course in Modern Hebrew,0415484170,9780415484176,17.11,3.99,2,23.1
The Self in Society,1609278674,9781609278670,67.17,4.49,2,73.66
Intrinsic and Extrinsic Motivation: The Search for Optimal Motivation and Performance (Educational Psychology),0126190704,9780126190700,4.0,3.99,2,9.99
Swift's Gulliver's Travels (Cliffs Notes),0822005697,9780822005698,0.01,3.99,2,6.0
Japanese: A Linguistic Introduction,1107611474,9781107611474,24.54,3.98,2,30.52
PassKey EA Review Workbook: Six Complete IRS Enrolled Agent Practice Exams: 2014-2015 Edition,1935664336,9781935664338,18.57,3.99,2,24.56
"Plato's Euthyphro, Apology, Crito and Phaedo (Cliffs Notes)",0822010445,0049086010442,0.1,4.89,2,6.99
"Workbook for the Elements of Music: Concepts and Applications, Vol. 1",007065493X,9780070654938,8.12,3.99,2,14.11
Pasajes: Lengua (Student Edition),0073385239,9780073385235,22.92,4.84,2,29.76
Tecnologia de refrigeracion y aire acondicionado / Refrigeration & Air Conditioning Technology (Spanish Edition)TOMO II,6074811423,9786074811421,54.57,3.99,2,60.56
Emerson's Essays (Cliffs Notes),0822004291,0785555009844,5.02,0,2,7.02
Building Services Engineering,0415699320,9780415699327,46.65,5.99,2,54.64
Dari Grammar and Phrase Book,1450099300,9781450099301,10.34,3.99,2,16.33
Romanian: An Essential Grammar (Routledge Essential Grammars),0415338255,9780415338257,40.07,3.99,2,46.06
A Doll's House and Hedda Gabler (Cliffs Notes),0822006146,0049086006148,1.0,3.99,2,6.99
Cliffs Notes on Huxley's Brave New World & Brave New World Revisited,0822002566,9780822002567,0.01,3.99,2,6.0
Entre Amis (World Languages),0495900230,9780495900238,29.5,3.99,2,35.49
"Introduction to Fluid Mechanics, Fourth Edition",1420085247,8580000376678,78.14,6.07,2,86.21
The Return of the Native (Cliffs Notes),0822011387,9780822011385,0.01,3.99,2,6.0
A Passage To India (Cliffs Notes),0822009854,9780822009856,1.0,3.99,2,6.99
"The Complete Guide to the TOEFL Test: iBT Edition, Text/CD-ROM/Online Tutorial",1111218080,9781111218089,60.0,3.99,2,65.99
"Kaplan PCAT 2015-2016 Strategies, Practice, and Review with 2 Practice Tests: Book + Online (Kaplan Test Prep)",1618658883,9781618658883,2.56,3.99,2,8.55
Environmental Science in Building (Building and Surveying Series),0230290809,9780230290808,24.71,3.95,2,30.66
Using German: A Guide to Contemporary Usage,0521530008,9780521530002,22.49,6.47,2,30.96
Mundo 21 (World Languages),0547171315,9780547171319,19.45,3.99,2,25.44
"Principles of Heating, Ventilating and Air-Conditioning, 6th edition",1933742690,9781933742694,3.19,3.99,2,9.18
"Air Conditioning Systems: Principles, Equipment, and Service",0135179211,9780135179215,145.33,3.99,2,151.32
"Oedipus the King, Oedipus at Colonus, and Antigone (Cliffs Notes)",0822007088,9780822007081,0.01,3.99,2,6.0
Sequences (World Languages),130510563X,9781305105638,65.0,3.99,2,70.99
Blush: Faces of Shame,0816627215,9780816627219,9.27,3.98,2,15.25
The Stories We Live By: Personal Myths and the Making of the Self,1572301880,9781572301887,14.1,3.99,2,20.09
Murder in America,0761920927,9780761920922,3.53,4.49,2,10.02
Ventures Basic Student's Book with Audio CD,1107641020,9781107641020,4.01,3.99,2,10.0
Seamos pragmáticos: Introducción a la pragmática española (Spanish and English Edition),030019109X,9780300191097,32.26,3.99,2,38.25
Envy: Theory and Research (Affective Science),0195327950,9780195327953,125.85,0,2,127.85
Wastewater Laboratory Analysts' Guide to Preparing for the Certification Examination,1572781645,9781572781641,102.69,0,2,104.69
Dicho y hecho: Beginning Spanish (Spanish Edition) - Standalone book,1118615611,9781118615614,104.26,3.99,2,110.25
Clear Speech from the Start Student's Book: Basic Pronunciation and Listening Comprehension in North American English,1107687152,9781107687158,13.93,4.84,2,20.77
Dutch For Dummies,047051986X,8601404631429,9.18,3.99,2,15.17
The Elements of Hittite (English and Hittite Edition),0521133009,9780521133005,31.86,3.99,2,37.85
Conexiones: Comunicación y cultura (5th Edition) (Myspanishlab),0205886973,9780205886975,57.57,0,2,59.57
English Phonetics and Phonology Paperback with Audio CDs (2): A Practical Course,052171740X,9780521717403,22.24,3.99,2,28.23
German: An Essential Grammar (Routledge Essential Grammars),041536602X,9780415366021,43.98,3.99,2,49.97
"Grammar Dimensions 2: Form, Meaning, Use (Grammar Dimensions: Form, Meaning, Use)",1413027415,9781413027419,10.03,3.99,2,16.02
Poe's Short Stories (Cliffs Notes),0822010461,0049086010466,1.79,3.99,2,7.78
Using Spanish: A Guide to Contemporary Usage,0521004810,9780521004817,33.06,3.99,2,39.05
Fundamentals of Arabic Grammar,0415710049,9780415710046,41.15,3.99,2,47.14
Developing Writing Skills in French,0415348978,9780415348973,18.48,3.99,2,24.47
Course in Nepali,0700710701,9780700710706,24.27,3.98,2,30.25
Lingüística Aplicada: Adquisición Del Español Como Segunda Lengua,1118407997,9781118407998,60.67,3.99,2,66.66
College Outline: Spanish Grammar (Books for Professionals),0156016893,9780156016896,10.28,5.2,2,17.48
"Bundle: Kaleidoskop, Loose-leaf Version, 9th + Quia™ eSAM, 4 terms (24 months) Multi-Term Printed Access Card",1305720865,9781305720862,275.99,3.99,2,281.98
Biosolids Land Appliers' Guide to Preparing for the Certification Examination,1572782641,9781572782648,99.94,3.99,2,105.93
Pipeline Design for Installation by Horizontal Directional Drilling: (Manuals and Reports on Engineering Practice),0784413509,9780784413500,54.15,3.99,2,60.14
Steam and Hot Water Primer,1428360727,9781428360723,253.89,3.99,2,259.88
"Heavy/Highway Construction Trainee Guide, Paperback (Contren Learning)",0130616117,9780130616111,65.0,0,2,67.0
Construction Management Strategies: A Theory of Construction Management,0470656093,9780521828086,17.95,3.99,2,23.94
Colloquial German (Colloquial Series),0415027993,9780415027991,4.57,3.99,2,10.56
Dutch: A Comprehensive Grammar (Routledge Comprehensive Grammars),0415154197,9780415154192,27.66,3.99,2,33.65
"Deutsch heute Worktext, Volume 1",1111832412,9781111832414,24.95,4.29,2,31.24
Kalaam Gamiil: An Intensive Course in Egyptian Colloquial Arabic. Volume 1 (Arabic Edition),977416315X,9789774163159,19.67,3.99,2,25.66
Scaffolding Level 1 Trainee Guide (2nd Edition),0133830810,9780133830811,749.95,4.5,2,756.45
"Heat Pipes: Theory, Design and Applications",0750667540,9780750667548,84.62,3.99,2,90.61
Construction Estimating Using Excel,0131719831,9780131719835,14.55,3.99,2,20.54
The Passivhaus Handbook: A Practical Guide to Constructing and Retrofitting Buildings for Ultra-Low Energy Performance (Sustainable Building),0857840193,9780857840196,23.67,3.99,2,29.66
Construction of Architecture: From Design to Built,0471783552,9780471783558,2.98,3.99,2,8.97
Japanese for Young People III: Student Book (Japanese for Young People Series),1568364784,9781568364780,20.74,3.99,2,26.73
Dickens' Hard Times (Cliffs Notes),0822005786,9780822005780,0.94,3.99,2,6.93
Security Risk Assessment and Management: A Professional Practice Guide for Protecting Buildings and Infrastructures,0471793523,9780471793526,18.35,3.99,2,24.34
An Introduction to Family Therapy: Systemic Theory and Practice,0335238017,9780335238019,38.0,3.98,2,43.98
PgMP Program Management Professional All-in-One Exam Guide,0071549277,9780071549271,20.02,3.99,2,26.01
Social Psychology (UK Higher Education Psychology),0077152352,9780077152352,31.0,5.99,2,38.99
CliffsNotes on Faulkner's Light in August,0822007444,0049086007442,1.49,3.99,2,7.48
Building Code Basics Residential Based on the 2006 International Residential Code (International Code Council Series),1435400658,9781435400658,14.99,5.29,2,22.28
An Introduction to Critical Social Psychology,0761962107,9780761962106,4.16,3.99,2,10.15
"Refrigeration Principles, Practices, and Performance",1418060976,0001418060976,19.5,5.51,2,27.01
Design and Operation of Civil and Environmental Engineering Systems,0471128163,9780471128168,5.49,0,2,7.49
"Heating, Ventilating, and Air Conditioning: HVAC Trainee Guide",0130604801,9780130604804,9.9,3.99,2,15.89
"Carpentry Forms, Level 3: Trainee Guide (Contren Learning Series)",0132286009,9780132286008,36.87,3.99,2,42.86
"Men's Violence Against Women: Theory, Research, and Activism",0805857710,9780805857719,7.38,3.99,2,13.37
"Concrete Mix Design, Quality Control and Specification",0415504996,9780415504997,114.95,0,2,116.95
Collection Systems Operators' Guide to Preparing for the Certification Examination,157278301X,9781572783010,101.15,5.63,2,108.78
"Manhattan GMAT Quantitative Strategy Guide Set, 5th Edition (Manhattan Gmat Strategy Guide: Instructional Guide)",1935707760,9781935707769,629.21,3.99,2,635.2
"Welding Level 2 Trainee Guide, Paperback, plus NCCERconnect with eText -- Access Card Package (4th Edition) (Contren Learning)",0132865955,9780132865951,125.95,4.99,2,132.94
The Bluest Eye and Sula (Cliffs Notes),0822002515,9780822002512,4.99,0,2,6.99
Basic Russian: A Grammar and Workbook (Grammar Workbooks),041569826X,9780415698269,18.0,5.13,2,25.13
Transportation Engineering: Planning and Design,0471173967,9780471173960,35.0,3.99,2,40.99
Environmental Problems/Behavioral Solutions (Environment and Behavior),0521319730,9780521319737,15.55,3.99,2,21.54
Pathological Altruism,0199738572,9780199738571,48.88,0,2,50.88
Peer Prejudice and Discrimination: The Origins of Prejudice,0805837728,9780805837728,3.73,3.99,2,9.72
Schaum's Outline of Strength of Materials 4th Edition,0070466173,0639785304524,1.99,3.99,2,7.98
"LEED v4 Green Associate Exam Guide (LEED GA): Comprehensive Study Materials, Sample Questions, Green Building LEED Certification, and Sustainability (Green Associate Exam Guide Series) (Volume 1)",161265018X,9781612650180,31.83,3.99,2,37.82
Social Psychology,0761907467,9780761907466,1.9,3.98,2,7.88
Ethical Behaviour in the E-Classroom: What the Online Student Needs to Know (Chandos Learning and Teaching Series),1843346893,9781843346890,N/A,N/A,N/A,N/A
The Sun Also Rises (Cliffs Notes),0822012375,9780822012375,0.1,4.89,2,6.99
College Outline for Probability and Statistics (HARCOURT BRACE JOVANOVICH COLLEGE OUTLINE SERIES),0156016761,9780156016766,7.99,5.34,2,15.33
The Stranger (Cliffs Notes),0822012294,0049086012293,0.01,3.99,2,6.0
Contrasts and Effect Sizes in Behavioral Research: A Correlational Approach,0521659809,9780521659802,18.27,3.99,2,24.26
The Spiral of Silence: New Perspectives on Communication and Public Opinion,0415509327,9780415509329,38.11,3.99,2,44.1
Intelligence: Multiple Perspectives,0030726298,9780030726293,2.97,3.99,2,8.96
Automotive Air Conditioning and Climate Control Systems,0750669551,9780750669559,41.25,5.99,2,49.24
"Air-cooled Heat Exchangers And Cooling Towers: Thermal-flower Performance Evaluation And Design, Vol. 2",1593700199,9781593700195,228.0,6.69,2,236.69
"Natural Ventilation of Buildings: Theory, Measurement and Design",047066035X,9780470660355,112.47,3.99,2,118.46
"A Greek-English Lexicon of the New Testament and Other Early Christian Literature, Second Edition",0226039323,9780226039329,23.0,3.99,2,28.99
All the Greek Verbs (Greek Language),0715617729,9780715617724,13.11,3.99,2,19.1
CliffsQuickReview Basic Math and Pre-Algebra,0822053047,0785555047037,0.01,3.99,2,6.0
Sewage Treatment Worker(Passbooks) (Career Examination Passbooks),0837307341,9780837307343,57.99,3.99,2,63.98
Fathers and Sons (Cliffs Notes),0822004704,0049086004700,1.89,3.99,2,7.88
"Expressive Details: Materials, Selection, Use",0070168334,9780070168336,1.5,3.99,2,7.49
Civil Drafting Technology (8th Edition) (What's New in Trades & Technology),0134436040,9780134436043,121.94,3.99,2,127.93
Piling Engineering,0415266467,9780415266468,110.0,3.99,2,115.99
A Greek Prose Course: Unit 4: Historiography,1853995401,9781853995408,10.65,3.99,2,16.64
Intermediate Chinese: A Grammar and Workbook (Grammar Workbooks),0415486319,9780415486316,33.14,3.99,2,39.13
Kallimni ‘Arabi fi Kull Haaga: A Higher Advanced Course in Spoken Egyptian Arabic 5 (Arabic Edition),9774162242,0009774162242,31.65,3.99,2,37.64
"Cry, the Beloved Country (Cliffs Notes)",0822003392,9780822003397,1.9,3.99,2,7.89
"Site Design and Construction Detailing, 3rd Edition",047128906X,9780471289067,58.93,5.1,2,66.03
Surveying with Construction Applications (6th Edition),0131709321,9780131709324,12.0,3.99,2,17.99
The CSI Construction Specifications Practice Guide,0470635207,9780470635209,119.99,0,2,121.99
Thinking Chinese Translation: A Course in Translation Method: Chinese to English (Thinking Translation),0415474191,9780415474191,19.37,4.91,2,26.28
German for Reading Knowledge (World Languages),1133604269,9781133604266,124.69,3.99,2,130.68
Persuasion: Social Influence and Compliance Gaining (3rd Edition),0205462162,9780205462162,2.23,3.99,2,8.22
Structural Wood Design: A Practice-Oriented Approach,0470056789,9780470056783,109.0,3.99,2,114.99
2012 International Energy Conservation Code with ASHRAE Standard (International Code Council Series),1609830911,9781609830915,31.95,4.97,2,38.92
"Pronunciation Pairs: An Introduction to the Sounds of English, Teacher's Manual",0521678099,9780521678094,12.0,3.94,2,17.94
Advanced Masonry Skills,0827321481,9780827321489,26.55,0,2,28.55
English Collocations in Use: Advanced,0521707803,9780521707800,26.78,3.99,2,32.77
Building Code Basics: Energy: Based on the International Energy Code (International Code Council Series),113328339X,9781133283393,14.99,3.99,2,20.98
Significant Changes to the International Residential Code 2018 Edition,1337271330,9781337271332,43.22,3.99,2,49.21
Blueprint Reading for Commercial Construction,0827316542,9780827316546,27.25,3.95,2,33.2
Colloquial Danish (Colloquial Series),0415301823,9780415301824,7.16,3.99,2,13.15
Aleph Isn't Tough: An Introduction to Hebrew for Adults,0807407267,9780807407264,33.99,3.99,2,39.98
The Complete Latin Course,0415596459,9780415596459,19.99,3.99,2,25.98
Ivanhoe (Cliffs Notes),0822006634,9780822006633,0.1,4.89,2,6.99
Georgian: A Reading Grammar (English and Georgian Edition),0893572071,9780893572075,25.0,3.99,2,30.99
Palabra abierta (World Languages),0618527745,9780618527748,19.79,3.95,2,25.74
"Concrete Pavement Design, Construction, and Performance",1466575107,9781466575103,79.99,3.99,2,85.98
Spanish for Mastery 3: Situaciones,0669086843,9780669086843,5.48,0,2,7.48
Voila!: A Course in French for Adult Beginners,0340813679,9780340813676,3.12,3.99,2,9.11
"Cognitive Psychology: Connecting Mind, Research and Everyday Experience",0534577326,9780534577322,0.99,3.99,2,6.98
"Dental Admission Test (DAT) Computerized Sample Tests and Guide, TopScore Pro for the DAT",0967275709,9780967275703,85.0,3.99,2,90.99
"The Oxford Handbook of Quantitative Methods, Two-Volume Set (Oxford Library of Psychology)",0199370176,9780199370177,1146.65,6.87,2,1155.52
Espana: Temas de cultura y civilizacion (World Languages),0838451497,9780838451496,19.47,3.99,2,25.46
Maintenance Painter(Passbooks) (Passbook for Career Opportunities),0837313589,9780837313580,48.55,3.99,2,54.54
The Evolution of Personality and Individual Differences,0195372093,9780195372090,68.99,3.99,2,74.98
The Changing Realities of Work and Family: A Multidisciplinary Approach (Blackwell/Claremont Applied Social Psychology Series),1405163461,9781405163460,29.39,3.99,2,35.38
WORKBOOK/LAB MANUAL V2  FOR PUNTOS DE PARTIDA: INVITATION TO SPANISH,1259622746,9781259622748,61.32,3.99,2,67.31
Constructing Identity in and around Organizations (Perspectives on Process Organization Studies),0199677417,9780199677412,N/A,N/A,N/A,N/A
The Psychology of Counterfactual Thinking (Routledge Research International Series in Social Psychology),0415758653,9780415758659,77.7,0,2,79.7
Beginner's Finnish (Hippocrene Beginner's)(w/2 CD's),0781812283,9780781812283,43.88,0,2,45.88
"Culture and Identity in a Muslim Society (Culture, Cognition, and Behavior)",0195310039,9780195310030,5.79,4.69,2,12.48
"Student Workbook for Long/ Carreira/Velasco/Swanson's Nexos, 4th",1305585100,9781305585102,109.64,3.99,2,115.63
Handbook of Forensic Psychology: Resource for Mental Health and Legal Professionals,0125241968,9780125241960,20.55,3.99,2,26.54
