title,isbn10,isbn13
SMART! Sports Medicine Assessment and Review Textbook: Expert Consult - Online and Print,1437702864,0001437702864
"DeLee & Drez's Orthopaedic Sports Medicine: 2-Volume Set (DeLee, DeLee and Drez's Orthopaedic Sports Medicine)",1455743763,9781455743766
Netter's Sports Medicine (Netter Clinical Science),0323395910,9780323395915
Wound Management: Principles and Practices (3rd Edition),0131395246,9780131395244
Dance Anatomy and Kinesiology-2nd Edition With Web Resource,1450469280,9781450469289
Therapeutic Modalities,0803625936,9780803625938
Examination of Orthopedic and Athletic Injuries,0803617208,9780803617209
"Orthopedic Taping, Wrapping, Bracing, and Padding",0803658486,9780803658486
Essentials of Athletic Injury Management,0078022614,9780078022616
NSCA'S Essentials of Personal Training - 2nd Edition,0736084150,8601400009345
ACSM's Research Methods,145119174X,9781451191745
Geometry for Enjoyment and Challenge,0866099654,9780866099653
Survey of Athletic Injuries for Exercise Science,1449648436,9781449648435
Emergency Response Management for Athletic Trainers (Athletic Training Education),0781775507,9780781775502
Fundamentals of Sports Injury Management,1451109768,0884831425559
Evidence-Guided Practice: A Framework for Clinical Decision Making in Athletic Training,1617116033,9781617116032
Therapeutic Exercise: From Theory to Practice,0803613644,9780803613645
Geometry problems and solutions from Mathematical Olympiads,0982771320,9780982771327
DESIGNING AND DRAWING TESSELLATIONS,0980219132,9780980219135
Area (My Path to Math),0778767892,9780778767893
Geometry (My Path to Math (Paperback)),0778743586,9780778743583
Under Pressure: Cooking Sous Vide (The Thomas Keller Library),1579653510,8601200635027
Living Ethics,1111186510,9781111186517
Ethical Issues in Professional Life,0195050266,9780195050264
Do the Right Thing: Readings in Applied Ethics and Social Philosophy,0534543359,9780534543358
Mathematics for Electrical Engineering and Computing,075065855X,9780750658553
Doing Ethics: Moral Reasoning and Contemporary Issues (Fourth Edition),0393265412,9780393265415
Military Ethics: An Introduction with Case Studies,0199846294,9780199846290
"Bioethics: Principles, Issues, and Cases",0190250100,9780190250102
Ethics: Theory and Contemporary Issues,0538452838,9780538452830
Ethics in City Hall: Discussion and Analysis for Public Administration,076375532X,9780763755324
The Ethical Life: Fundamental Readings in Ethics and Contemporary Moral Problems,0190631317,9780190631314
Ethics: Theory and Practice (11th Edition),0133804054,9780133804058
Introduction to Optimal Estimation (Advanced Textbooks in Control and Signal Processing),185233133X,9781852331337
Foundations for Clinical Mental Health Counseling: An Introduction to the Profession (3rd Edition),0134384776,9780134384771
Transforming the School Counseling Profession (5th Edition) (Merrill Counseling),0134610598,9780134610597
Transforming the School Counseling Profession (4th Edition) (Merrill Counseling (Hardcover)),0133351890,9780133351897
Counseling Strategies and Interventions for Professional Helpers (9th Edition) (The Merrill Counseling Series),0133905225,9780133905229
The Fashion Industry and Its Careers: An Introduction,1628923415,9781628923414
Justice: What's the Right Thing to Do?,0374532508,9780374532505
"Ethics: Theory and Contemporary Issues, Concise Edition (MindTap Course List)",1305077504,9781305077508
Ethics for the Information Age (7th Edition),0134296540,9780134296548
The Bioethics of Pain Management: Beyond Opioids (Routledge Annals of Bioethics),0415746736,9780415746731
Kant: Groundwork of the Metaphysics of Morals (Cambridge Texts in the History of Philosophy),1107401062,9781107401068
The Moral of the Story: An Introduction to Ethics,1259907961,9781259907968
Architecture and Interior Design: An Integrated History to the Present (Fashion Series),0135093570,9780135093573
Becoming a Master Student (MindTap Course List),128519389X,9781285193892
School Counselors as Educational Leaders (School Counseling),0618567933,9780618567935
Creating Career Success: A Flexible Plan for the World of Work (New 1st Editions in College Success),1133313906,9781133313908
Career Achievement: Growing Your Goals,0077831888,9780077831882
School Counseling for the 21st Century (5th Edition),0131890379,9780131890374
Essential Topics for the Helping Professional,020541401X,9780205414017
"Career Counseling: A Holistic Approach, 8th Edition (Graduate Career Counseling)",0840034350,9780840034359
"Developing Fieldwork Skills: A Guide for Human Services, Counseling, and Social Work Students",0534346545,9780534346546
Atlas of African-American History (Facts on File Library of American History),0816067147,9780816067145
Guide to UNIX Using Linux (Networking (Course Technology)),1418837237,9781418837235
"It's All for the Kids: Gender, Families, and Youth Sports",0520257103,0884566083222
"The Architecture Of Light (2nd Edition): A textbook of procedures and practices for the Architect, Interior Designer and Lighting Designer.",0980061717,9780980061710
Beginnings of Interior Environments (11th Edition) (Fashion Series),0132786001,9780132786003
History of Interior Design,1118403517,9781118403518
Revit Architecture 2018 for Designers,1501327704,9781501327704
Essential Study Skills (MindTap Course List),1285430093,9781285430096
Substance Use Counseling: Theory and Practice (6th Edition) (The Merrill Counseling Series),0134055934,9780134055930
Reaching Your Potential: Personal and Professional Development (Textbook-specific CSFI),1435439732,9781435439733
Counseling: A Comprehensive Profession with MyLab Counseling with Pearson eText - Access Card Package (8th Edition) (Merrill Counseling),0134055667,9780134055664
Becoming a Master Student (Textbook-specific CSFI),1111827532,9781111827533
Your Guide to College Success: Strategies for Achieving Your Goals (Textbook-specific CSFI),1111834334,9781111834333
Student Success in College: Doing What Works! (MindTap Course List),1285852176,9781285852171
FOCUS on Community College Success (Textbook-specific CSFI),0495906433,9780495906438
The College Experience Compact (2nd Edition),0321980026,9780321980021
"Introduction to PLCs, Second Edition",1594603316,9781594603310
"Project Managing E-Learning: A Handbook for Successful Design, Delivery and Management",0415772206,9780415772204
The Routledge Historical Atlas of Religion in America (Routledge Atlases of American History),0415921376,9780415921374
The Penguin Atlas of Women in the World: Fourth Edition,0143114514,9780143114512
Atlas Of The Civil War,0762423560,9780762423569
The New Atlas of World History: Global Events at a Glance,0691152691,9780691152691
Atlas of Slavery,0582437806,9780582437807
The Atlas of Human Rights: Mapping Violations of Freedom Around the Globe (Atlas Of... (University of California Press)),0520261232,9780520261235
The Palgrave Concise Historical Atlas of Eastern Europe: Revised and Updated,0312239858,9780312239855
Minnesota St. Louis County Fishing Map Guide (Fishing Maps from Sportsman's Connection),188501032X,9781885010322
3D Engine Design for Virtual Globes,1568817118,9781568817118
Wisconsin's Past and Present: A Historical Atlas,029915940X,9780299159405
Networking Essentials: A CompTIA Network+ N10-007 Textbook (5th Edition) (Pearson IT Cybersecurity Curriculum (ITCC)),0789758741,9780789758743
Network Management: Principles and Practices (2nd Edition),8131734048,9788131734049
"Computer Vision: Principles, Algorithms, Applications, Learning",012809284X,9780128092842
Guide to Networking Essentials,1305105435,9781305105430
Network+ Guide to Networks (MindTap Course List),1305090942,9781305090941
"The Architecture of Computer Hardware, Systems Software, and Networking: An Information Technology Approach",1118322630,9781118322635
Network Security Essentials: Applications and Standards (6th Edition),013452733X,9780134527338
Data Communications and Computer Networks: A Business User's Approach,1305116631,9781305116634
Business Data Communications and Networking,1118891686,9781118891681
Computer Networks (5th Edition),0132126958,8601300091266
Designing the Physical Education Curriculum: Promoting Active Lifestyles,0767410084,9780767410083
"Game Sense: Pedagogy for Performance, Participation and Enjoyment (Routledge Studies in Physical Education and Youth Sport)",0415532884,9780415532884
Children Moving: A Reflective Approach to Teaching Physical Education,0073376450,9780073376455
Interdisciplinary Learning Through Dance:101 Moventures,0736046429,9780736046428
Strength and Conditioning for Young Athletes: Science and application,0415694892,9780415694896
Physical Activity Interventions in Children and Adolescents,0736051325,9780736051323
CHEMISTRY 2012 STUDENT EDITION (HARD COVER) GRADE 11,0132525763,9780132525763
"Substance Abuse: Information for School Counselors, Social Workers, Therapists and Counselors (5th Edition)",0132613247,9780132613248
A Complete French Grammar for Reference and Practice,0761849718,9780761849711
Social and Personality Development,0495600385,9780495600381
Close-Range Photogrammetry and 3D Imaging (de Gruyter Textbook),3110302691,9783110302691
"Practical Guide to Patternmaking for Fashion Designers: Juniors, Misses and Women",1563673282,9781563673283
Colonial North America and the Atlantic World: A History in Documents,0132342375,9780132342377
Hearing Form - Textbook and Anthology Pack: Musical Analysis With and Without the Score,1138900699,9781138900691
Interior Design Materials and Specifications: Studio Instant Access,1501317598,9781501317590
Interiors,0073526509,9780073526508
Space Planning Basics,1118882008,9781118882009
Interior Design (4th Edition),0132408902,9780132408905
Professional Practice for Interior Designers,1118090799,9781118090794
The Art of Floral Design,0827386273,9780827386273
Understanding Child Abuse and Neglect (9th Edition),020539969X,9780205399697
Thinking Critically About Ethical Issues,0073535907,9780073535906
"Hotel, Restaurant, and Travel Law, 7th Edition",1418051918,9781418051914
Light on the Path: A Christian Perspective on College Success (Textbook-specific CSFI),1439085528,9781439085523
On Course Study Skills Plus Edition (MindTap Course List),1305397487,9781305397484
Essential Study Skills (Textbook-specific CSFI),0495913502,9780495913504
"On Course, Study Skills Plus Edition (Textbook-specific CSFI)",1439085226,9781439085226
Tonal Harmony,125944709X,9781259447099
Rock and Roll: Its History and Stylistic Development (7th Edition),0205246974,9780205246977
"Children's Literature, Briefly (5th Edition)",0132480565,0000132480565
Mapping Latin America: A Cartographic Reader,0226618226,9780226618227
Atlas of Hispanic-American History (Facts on File Library of American History),0816077363,9780816077366
"The West Point Atlas of American Wars: Vol. 1, 1689-1900",0805033912,9780805033915
An Atlas and Survey of South Asian History (Sources and Studies in World History),1563243342,9781563243349
Atlas of American History (Facts on File),0816059527,9780816059522
Data Communications and Networking,0073376221,8601400052488
"Business Data Communications- Infrastructure, Networking and Security (7th Edition)",0133023893,9780133023893
"Fundamentals of Neural Networks: Architectures, Algorithms And Applications",0133341860,9780133341867
Wireless Sensor Networks: From Theory to Applications,1466518103,9781466518100
Network Security Essentials Applications and Standards (5th Edition),0133370437,9780133370430
World of Chemistry,0618562753,9780618562756
Modern Chemistry: Student Edition 2012,0547586639,9780547586632
Exploring Creation With Chemistry,1932012265,9781932012262
McDougal Littell Middle School Science: Student Edition Grades 6-8 Chemical Interactions 2005,0618334386,9780618334384
Modern Chemistry: Student Edition 2007,0030922046,9780030922046
Glencoe Chemistry: Matter and Change,0078964059,9780078964053
Genetics: Breaking the Code of Your DNA (Inquire and Investigate),1619302128,9781619302129
"Chemistry: The Central Science, AP Edition",0132175088,9780132175081
A Guide to Crisis Intervention (MindTap Course List),1337566411,9781337566414
"The Use of Data in School Counseling: Hatching Results for Students, Programs, and the Profession",1452290253,9781452290256
Elements of Crisis Intervention: Crisis and How to Respond to Them (HSE 225 Crisis Intervention),0495007811,9780495007814
Counseling Strategies that Work! Evidence-based Interventions for School Counselors,0205445586,9780205445585
"At Risk Youth, 5th Edition",0840028598,9780840028594
"Crisis Intervention Strategies, 6th Edition",0495100269,9780495100263
Substance Abuse Prevention: The Intersection of Science and Practice,0205341624,9780205341627
The Handbook for School Safety and Security: Best Practices and Procedures,0128005688,9780128005682
Ultimate Italian Advanced (Book) (Ultimate Advanced),1400020646,9781400020645
Ultimate Russian Advanced (Coursebook) (Ultimate Advanced),1400020700,9781400020706
Medical Spanish: Interviewing the Latino Patient - A Cross Cultural Perspective,0135725127,9780135725122
Fonética y fonología espanolas,0471466492,9780471466499
"The Complete Idiot's Guide to Learning German, 4E",1615643141,9781615643141
Ultimate Spanish Advanced,1400020735,9781400020737
Japanese Core Words and Phrases: Things You Can't Find in a Dictionary,1568364881,9781568364889
Lives Across Cultures: Cross-Cultural Human Development (5th Edition),0205841740,9780205841745
"Developmental Science: An Advanced Textbook, Sixth Edition",1848728719,9781848728714
An Introduction to Developmental Psychology (BPS Textbooks in Psychology),1118767209,9781118767207
Developmental Psychology: Revisiting the Classic Studies,0857027581,9780857027580
AAP Developmental and Behavioral Pediatrics,1581102747,9781581102741
The Development of Children,1429243287,0783324843736
Developmental Psychology: Childhood and Adolescence,1111834520,9781111834524
Developmental Psychology (Critical Thinking in Psychology Series),0857252763,9780857252760
The Mind's Machine,1605352764,9781605352763
Psychology Applied to Modern Life: Adjustment in the 21st Century (MindTap Course List),1305968476,9781305968479
Introduction to Electrodynamics (3rd Edition),013805326X,9780138053260
Electricity and Magnetism,1107014026,9781107014022
Modern Electrodynamics,0521896975,9780521896979
Engineering Electromagnetic Fields and Waves,0471098795,9780471098799
Electrodynamics of Continuous Media: Volume 8 (Course of Theoretical Physics S),0750626348,9780750626347
Engineering Magnetohydrodynamics (Dover Civil and Mechanical Engineering),0486450325,9780486450322
Topological Insulators and Topological Superconductors,069115175X,9780691151755
Electromagnetism: Problems with Solutions,8120346335,9788120346338
Professional Management of Housekeeping Operations,047176244X,9780471762447
"Black & Decker The Complete Guide to Roofing & Siding: Updated 3rd Edition - Choose, Install & Maintain Roofing & Siding Materials (Black & Decker Complete Guide)",158923717X,0052944019006
Introduction to Housing,0131190423,9780131190429
Pattern Cutting for Women's Tailored Jackets: Classic and Contemporary,0632054670,9780632054671
"Modern Industrial Electronics, Fifth Edition",0130487414,9780130487414
"Electronic Troubleshooting, Fourth Edition",0071819908,9780071819909
"The Upholsterer's Pocket Reference Book: Materials, Measurements, Calculations",0946819718,9780946819713
VCR Troubleshooting and Repair,075069940X,9780750699402
Surveying Historic Buildings,1873394675,9781873394670
"The Revolutionary Era, 1789-1850 (The Norton History of Modern Europe)",0393978605,9780393978605
The First Prejudice: Religious Tolerance and Intolerance in Early America (Early American Studies),0812223144,9780812223149
"Major Problems in the Era of the American Revolution, 1760-1791: Documents and Essays (Major Problems in American History Series)",0395903440,9780395903445
"Red, White, and Black (6th Edition)",0205692370,2900205692377
The Blessings of Liberty: A Concise History of the Constitution of the United States,1442259922,9781442259928
In My Power: Letter Writing and Communications in Early America (Early American Studies),0812221818,9780812221817
"Revolution in Virginia, with a new Foreword",0879352337,9780879352332
"Red, White, and Black: The Peoples of Early North America (5th Edition)",013193550X,9780131935501
African Muslims in Antebellum America: Transatlantic Stories and Spiritual Struggles,0415912709,9780415912709
These Fiery Frenchified Dames: Women and Political Culture in Early National Philadelphia (Early American Studies),0812217772,9780812217773
Colonial and Revolutionary America,0205809693,9780205809691
The American Revolution Reader (Routledge Readers in History),0415537576,9780415537575
Abraham in Arms: War and Gender in Colonial New England (Early American Studies),0812219619,9780812219616
The Professional Chef,0470421355,0884713890789
Anatomy for the Artist,078948045X,8601410866938
Strength and Conditioning for Sports Performance,0415578213,9780415578219
Welcome to Church Music & The Hymnal 1982,0819229423,9780819229427
"Internetworking with TCP/IP, Vol. III: Client-Server Programming and Applications, Linux/Posix Sockets Version",0130320714,9780130320711
Transgender 101: A Simple Guide to a Complex Issue,0231157134,9780231157131
"A Medieval Life: Cecilia Penifader of Brigstock, c. 1295-1344",0072903317,9780072903317
Computer Organization and Design RISC-V Edition: The Hardware Software Interface (The Morgan Kaufmann Series in Computer Architecture and Design),0128122757,9780128122754
"Multiculturalism, Crime, and Criminal Justice",0190642637,9780190642631
The Picture of Dorian Gray (Norton Critical Edition),0393927547,9780719546686
Ultimate Spanish Beginner-Intermediate (Coursebook) (Ultimate Beginner-Intermediate),1400009618,9781400009619
Hitler: Profiles in Power,0582437563,9780582437562
Dvorák: Cello Concerto (Cambridge Music Handbooks),0521669030,9780521669030
Analysing Architecture (Volume 1),041571916X,9780415719162
Basics Interior Architecture 05: Texture + Materials,2940411530,9782940411535
Materials for Interior Environments,111830635X,9781118306352
Interior Design: A Critical Introduction,1847883125,9781847883124
Evidence-Based Design for Interior Designers,1563677598,9781563677595
"Integrated Korean: Beginning 1, 2nd Edition (Klear Textbooks in Korean Language)",0824834402,0783324852189
Violence and Maltreatment in Intimate Relationships,1506323812,9781506323817
Child Maltreatment: An Introduction (Volume 3),1452205795,9781452205793
Building the Bonds of Attachment: Awakening Love in Deeply Traumatized Children,1442274131,9781442274136
"Child Abuse and Neglect: Attachment, Development and Intervention",1403948267,9781403948267
Child Abuse and Culture: Working with Diverse Families,1593851308,9781593851309
Repair for Kids: A Children's Program for Recovery from Incest and Childhood Sexual Abuse,1932690573,9781932690576
Introduction to Working with Adult Survivors of Childhood Trauma: Techniques and Strategies (Mental Health Practice),0495006181,9780495006183
An Introduction to Quality Assurance in Health Care,0195158091,9780195158090
Silverthorn (Turtleback School & Library Binding Edition) (Riftwar Saga),0613293452,9780613293457
Resorts: Management and Operation,1118071824,9781118071823
The Wine Bible,0761180834,9780761180838
Material World: A Global Family Portrait,0871564300,9780871564306
Milady Standard Esthetics: Fundamentals (MindTap Course List),1111306893,9781111306892
Reading Contemporary Picturebooks: Picturing Text,0415208874,9780415208871
Becoming a Master Student (MindTap Course List),1337097101,9781337097109
Assessment Procedures for Counselors and Helping Professionals (7th Edition),0137152523,9780137152520
Tonal Harmony,0078025141,9780078025143
Tonal Harmony: With an Introduction to Twentieth Century Music,0073401358,9780073401355
Concise Introduction to Tonal Harmony,0393264769,9780393264760
Harmony in Context,0073137944,9780073137940
"Workbook: for Harmonic Practice in Tonal Music, Second Edition",039397667X,9780393976670
Schenker Guide: A Brief Handbook and Website for Schenkerian Analysis,0415973988,9780415973984
Harmony and Voice Leading,0155062425,9780155062429
Advanced Harmony: Theory and Practice (5th Edition),0130833398,9780130833396
Popular World Music,013612898X,9780136128984
Rock Music Styles: A History,0078025184,9780078025181
Cambridge International AS and A Level Chemistry Coursebook with CD-ROM (Cambridge International Examinations),1107638453,9781107638457
Complete Chemistry for Cambridge Secondary 1 Student Book: For Cambridge Checkpoint and beyond (CIE Checkpoint),0198390181,9780198390183
Chemistry Advanced Placement Seventh Edition,0618713700,9780618713707
Addison Wesley Chemistry,0201861607,9780201861600
Complete Chemistry for Cambridge IGCSERG with CD-ROM (Second Edition),0199138788,9780199138784
Substance Abuse and Addiction Treatment: Practical Application of Counseling Theory,013254265X,9780132542654
"Brief Intervention for School Problems, Second Edition: Outcome-Informed Strategies (The Guilford School Practitioner Series)",1606239309,9781606239308
Disrupting the School-to-Prison Pipeline (HER Reprint Series),0916690547,9780916690540
Substance Abuse Counseling: Theory and Practice (4th Edition),0132409038,9780132409032
Assessment for Crisis Intervention: A Triage Assessment Model,053436232X,9780534362324
Wellness Counseling (The Merrill Counseling Series),0132330520,9780132330527
Slovak for You (Slovecina Pre Vas) (English and Slovak Edition),0865163316,9780865163317
Lao Basics: An Introduction to the Lao Language (Audio CD Included) (Tuttle Basics),0804840997,9780804840996
Ultimate German Advanced (Coursebook) (Ultimate Advanced),1400020581,9781400020584
"Advanced French Coursebook: Complete Course, Revised & Updated (Advanced Complete Basic Courses)",0609804499,9780609804490
A Japanese Phrase A Day Practice Pad (Tuttle Practice Pads),4805310855,9784805310854
Developing Person Through Childhood and Adolescence,1319058132,9781319058135
A Comprehensive Guide to Intellectual and Developmental Disabilities,1557667004,9781557667007
Social Policy for Children and Families: A Risk and Resilience Perspective (Volume 3),148334455X,9781483344553
Development Across the Life Span (7th Edition),0205940072,9780205940073
Developmental Psychology: The Growth of Mind and Behavior,0393124010,9780393124019
Mathematica for Theoretical Physics: Classical Mechanics and Nonlinear Dynamics,0387016740,9780387016740
Magnetic Particle Testing: Classroom Training Book,1571171185,9781571171184
Magnetism in Condensed Matter (Oxford Master Series in Physics),0198505914,9780198505914
E&M TIPERs: Electricity & Magnetism Tasks,0131854992,9780131854994
Superconducting Magnets (Monographs on Cryogenics),0198548109,9780198548102
Practical VCR Repair,0827365837,9780827365834
Foodservice Organizations: A Managerial and Systems Approach (5th Edition),0130486892,9780130486899
Schematic Wiring a Step-By-Step Guide,0912524669,9780912524665
"The Triumph of Individual Style : A Guide to Dressing Your Body, Your Beauty, Your Self",1563672693,9781563672699
Management by Menu,0471413194,9780471413196
"The Origins of the Federal Republic: Jurisdictional Controversies in the United States, 1775-1787",0812211677,9780812211672
That Ever Loyal Island: Staten Island and the American Revolution,0814767664,9780814767665
Food for Fifty (14th Edition) (What's New in Culinary & Hospitality),0134437187,9780134437187
Essentials of Professional Cooking,1118998707,9781118998700
Culinary Calculations: Simplified Math for Culinary Professionals,0471748161,9780471748168
Food for Fifty: 9th edition,0024103411,0000024103411
Understanding Animation,0415115973,9780415115971
Japanese in MangaLand 3: Intermediate Level (Japanese in MangaLand Series),4889961879,9784889961874
EXPOSÉ 7: The Finest Digital Art in the Known Universe,1921002646,9781921002649
An Introduction to the History of Psychology (PSY 310 History and Systems of Psychology),0495506214,9780495506218
Counseling the Culturally Diverse: Theory and Practice,1118022025,9781118022023
Behavior Modification: What It Is and How To Do It,0205992102,9780205992102
The Making of Slap Shot: Behind the Scenes of the Greatest Hockey Movie Ever Made,0470159413,9780470159415
Progressive Sight Singing,0195178475,9780195178470
The Illustrated Network: How TCP/IP Works in a Modern Network (The Morgan Kaufmann Series in Networking),0123745411,9780123745415
The Routledge Queer Studies Reader (Routledge Literature Readers),0415564115,9780415564113
"When Heroes Love: The Ambiguity of Eros in the Stories of Gilgamesh and David (Gender, Theory, and Religion)",0231132603,9780231132602
Odd Girls and Twilight Lovers: A History of Lesbian Life in Twentieth-Century America,0231074891,9780231074896
Queer Theory and the Jewish Question (Between Men-Between Women: Lesbian and Gay Studies),0231113757,8580000295290
"Between Women: Friendship, Desire, and Marriage in Victorian England",0691128359,9780691128351
"The Interesting Narrative of the Life of Olaudah Equiano, or Gustavus Vassa, the African, Written by Himself (Norton Critical Editions)",0393974944,8601416937908
The Godwins: The Rise and Fall of a Noble Dynasty,0582784409,9780582784406
Life and Times of William IV (Kings & Queens),0297778390,9780297778394
Anne Hutchinson: Puritan Prophet (Library of American Biography),0321476212,9780321476210
Edmund Burke: Volume II: 1784-1797,0199541531,9780199541539
Elementary Information Security,1284055930,9781284055931
