title,isbn10,isbn13
Social Psychology (Fourth Edition),0393906078,9780393906073
"Transformations: Women, Gender and Psychology",0073532150,9780073532158
Guide to Wireless Communications,1111307318,8601421972987
"Keys to Nursing Success, Revised Edition (3rd Edition)",0137036841,9780137036844
"Networking Self-Teaching Guide: OSI, TCP/IP, LANs, MANs, WANs, Implementation, Management, and Maintenance",0470402385,9780470402382
Jazz Composition and Arranging in the Digital Age,0195381009,9780195381009
"Taking Sides: Clashing Views in United States History, Volume 1: The Colonial Period to Reconstruction (Taking Sides. Clashing Views in United States History(2 Vol Set))",1259217078,9781259217074
Workbook/Study Guide I (Lessons 1-26) to accompany Destinos: An Introduction to Spanish,0070020728,9780070020726
Fundamentals of Residential Construction,1118977998,9781118977996
"McGraw-Hill's Math, Grade 7",0071748636,9780071748636
"Delavier's Sculpting Anatomy for Women: Shaping your core, butt, and legs",1450434754,9781450434751
"Cognition and Suicide: Theory, Research, and Therapy",1591473578,9781591473572
"Lab Manual for Smith’s Electricity for Refrigeration, Heating and Air Conditioning",1111038759,9781111038755
Magnetic Actuators and Sensors,1118505255,9781118505250
Power: Why Some People Have It and Others Don't,0061789089,9780061789083
Transnational LGBT Activism: Working for Sexual Rights Worldwide,0816692742,9780816692743
Drafting & Design: Basics for Interior Design,1563678373,9781563678370
Introduction to Hospitality (7th Edition),0133762769,9780133762761
Know Your Fashion Accessories,1563672456,9781563672453
Dyeing and Screen-Printing on Textiles: Revised and updated,1408124750,9781408124758
JJ Pizzuto's Fabric Science 10th Edition,1609013808,9781609013806
A Guide to Fashion Sewing: Studio Access Card,1628921846,9781628921847
Fashion Theory: A Reader (Routledge Student Readers),0415413400,9780415413404
Textiles for Residential and Commercial Interiors,1609019377,9781609019372
Costume History and Style,0131812149,9780131812147
Holt McDougal Larson Pre-Algebra: Student Edition 2012,0547587775,9780547587776
Ecrits: The First Complete Edition in English,0393061159,9780393061154
Against Method,1844674436,9781844674435
Karl Popper: Critical Appraisals,0415319706,9780415319706
Digital Transmission Engineering,0471694649,9780471694649
Understanding Child Development (What’s New in Early Childhood),0495809306,9780495809302
P.O.W.E.R. Learning: Strategies for Success in College and Life,0077842154,9780077842154
Criminal Justice Ethics: Theory and Practice,1412995450,9781412995450
Moral Philosophy: A Reader,0872209628,9780872209626
"Consider Ethics: Theory, Readings, and Contemporary Issues (3rd Edition)",0205017738,8581000030829
A 21st Century Ethical Toolbox,019062115X,9780190621155
Introductory Chemistry in the Laboratory (Lab Manual) 5th edition,0618305289,9780618305285
Chemistry for CSEC CXC Study Guide,1408522489,9781408522486
Holt McDougal Modern Chemistry: Student Edition 2015,0544023730,9780544023734
Cambridge International AS and A Level Chemistry Teacher's Resource CD-ROM (Cambridge International Examinations),110767770X,9781107677708
Chemistry,0130645389,9780130645388
Chemistry: Experimental Foundations,0131290819,9780131290815
"Holt Modern Chemistry: Workbook, Student Edition Skills Practice Experiments",0030367972,9780030367977
Pennsylvania History: Essays and Documents,0205701663,9780205701667
Unsettled: Cambodian Refugees in the New York City Hyperghetto (Asian American History & Cultu),1439911657,9781439911655
The Sacco and Vanzetti Case: A Brief History with Documents (The Bedford Series in History and Culture),0312400888,9780312400880
"Making a New Deal: Industrial Workers in Chicago, 1919-1939 (Canto Classics)",1107431794,9781107431799
The Bridge: The Building of the Verrazano-Narrows Bridge,1620406667,9781620406663
Archaeology of the Southwest,1598746758,9781598746754
"Sam Houston and the American Southwest, 3rd Edition (Library of American Biography)",0321385721,0000387096078
Tobacco Town Futures: Global Encounters in Rural Kentucky,1577667085,9781577667087
"Death in the Midst of Life: Social and Cultural Influences on Death, Grief, and Mourning",0131977083,9780131977082
Essentials for the Activity Professional in Long Term Care,0827373872,9780827373877
"The Nursing Assistant: Acute, Subacute, and Long-Term Care with Workbook (5th Edition)",0132855151,9780132855150
Aging Hair,3642026354,9783642026355
Oxford Handbook of Palliative Care (Oxford Medical Handbooks),0199234353,9780199234356
CORE CURRICULUM FOR THE GENERALIST HOSPICE AND PALLIATIVE NURSE,075752169X,9780757521690
Study Guide for the Generalist Hospice and Palliative Nurse,0757562094,9780757562099
Palliative Care: Transforming the Care of Serious Illness,047052717X,9780470527177
EMQs for the MRCS Part A (Oxford Specialty Training: Revision Texts),0199645647,9780199645640
Nutrition Care Of The Older Adult: A Handbook For Dietetics Professionals Working Throughout The Continuum Of Care,0880913320,9780880913324
Dementia With Dignity,0074707523,9780074707524
A Pocket Guide to Epidemiology,0387459642,9780387459646
Social Psychology (13th Edition),0205205585,9780205205585
The Person and the Situation: Perspectives of Social Psychology,1905177445,8581085999998
Essentials of Understanding Psychology,1259531805,9781259531804
Women's Lives: A Psychological Exploration (3rd Edition),0205255639,9780205255634
Social Psychology,1506357512,9781506357515
Social Psychology: The Science of Everyday Life,0716704226,9780716704225
Hands-On Networking Fundamentals,1111306745,9781111306748
"MCSA Guide to Installation, Storage, and Compute with Microsoft Windows Server2016, Exam 70-740 (Networking)",1337400661,9781337400664
Scaling Networks Lab Manual (Lab Companion),1587133253,9781587133251
Introduction to Networking with Network+,0470487321,9780470487327
Go! All in One: Computer Concepts and Applications (2nd Edition) (GO! for Office 2013),0133427293,9780133427295
Computer Networking: A Top-Down Approach (6th Edition),0132856204,9780132856201
GO! All in One: Computer Concepts and Applications (3rd Edition) (GO! for Office 2016 Series),0134505743,9780134505749
Organic Chemistry: A Guided Inquiry,0618974121,9780618974122
"Schaum's Outline of Mathematical Handbook of Formulas and Tables, 4th Edition: 2,400 Formulas + Tables (Schaum's Outlines)",0071795375,9780071795371
Kaplan GMAT 800: Advanced Prep for Advanced Students (Kaplan Test Prep),1618654063,0783324943764
Engineering Economic Analysis,0199778124,9780199778126
MCAT Complete 7-Book Subject Review 2018-2019: Online + Book (Kaplan Test Prep),1506223958,9781506223957
Wireless Communications & Networking (The Morgan Kaufmann Series in Networking),0123735807,9780123735805
Hands-On Novell Open Enterprise Server for Netware and Linux,1418835315,9781418835316
Simulation Techniques: Models of Communication Signals and Processes (Vol 1),0471519642,9780471519645
"Data Communications Networking Devices: Operation, Utilization and Lan and Wan Internetworking, 4th Edition",047197515X,9780471975151
"Network Design: A Process for Designing and Managing Data Networks, Release 8.0",1586761617,9781586761615
Improving the Performance of Wireless LANs: A Practical Guide (Chapman & Hall/CRC Computer and Information Science Series),1466560630,9781466560635
MCTS Windows SharePoint Services 3.0 Configuration Study Guide: Exam 70-631,0470449314,9780470449318
The Emergence of Rock and Roll: Music and the Rise of American Youth Culture (Critical Moments in American History),0415833132,9780415833134
Concise Guide to Jazz Plus NEW MyLab Search with eText - Access Card Package (7th Edition),0205955231,9780205955237
Think Rock,0205772994,9780205772995
Exploring Latin Piano: South-American/Cuban/Spanish Rhythms Intermediate Book/2cds,1847611354,0841886012530
Jazz: the Basics,0415966949,9780415966948
Understanding Popular Music Culture,1138907855,9781138907850
Exploring Jazz Violin (Schott Pop Styles),1847612423,9781847612427
American Popular Music: From Minstrelsy to MP3,0195396308,8580000848687
Queering the Pitch: The New Gay and Lesbian Musicology,041597884X,9780415978842
"Exploring American Folk Music: Ethnic, Grassroots, and Regional Traditions in the United States (American Made Music Series)",1617032646,9781617032646
Rocking the Classics: English Progressive Rock and the Counterculture,0195098889,9780195098884
"Bards, Ballads and Boundaries: An Ethnographic Atlas of Music Traditions in West Rajasthan",1905422075,9781905422074
"Taking Sides: Clashing Views in United States History, Volume 2: Reconstruction to the Present",1259180700,9781259180705
Dangerous Economies: Status and Commerce in Imperial New York (Early American Studies),0812220579,9780812220575
"The Creation of the American Republic, 1776-1787",0807847232,9780807847237
The Early American Republic: A Documentary Reader,1405160985,9781405160988
"Taking Sides: Clashing Views in United States History, Volume 1: The Colonial Period to Reconstruction",1259677540,9781259677540
Coming Over: Migration and Communication Between England and New England in the Seventeenth Century,0521338506,9780521338509
"Chez nous: Branché sur le monde francophone, Media-Enhanced Version (4th Edition)",0205933769,9780205933761
"Connections II [text + workbook], Textbook & Workbook: A Cognitive Approach to Intermediate Chinese (Chinese in Context Language Learning Series)",0253216656,9780253216656
An Introduction to Japanese Linguistics,1444337734,9781444337730
"Prego! An Invitation to Italian, 8th Edition",0073386251,8601406250055
Integrated Korean Workbook: Intermediate 2 (Klear Textbooks in Korean Language) (Korean and English Edition),082483867X,9780824838676
Latin: An Intensive Course,0520031830,9780520031838
REALIDADES LEVELED VOCABULARY AND GRMR WORKBOOK (CORE & GUIDED PRACTICE) LEVEL 2 COPYRIGHT 2011,0133692698,9780133692693
"Lecture Ready Student Book 3, Second Edition",0194417298,9780194417297
Sentence-Combining Workbook,1305391837,9781305391833
Managing Sport Facilities - 2nd Edition,0736082905,9780736082907
"Sport Promotion and Sales Management, Second Edition",073606477X,9780736064774
"Rethinking Disney: Private Control, Public Dimensions",0819567906,9780819567901
"Anatomy of a Park: Essentials of Recreation Area Planning and Design, Fourth Edition",1478622024,9781478622024
Research Methods for Sport Management (Foundations of Sport Management),0415572568,9780415572569
Events Management: An Introduction,041557742X,9780415577427
"The Economics of Recreation, Leisure and Tourism",0080890504,9780080890500
"The Economics of Recreation, Leisure and Tourism",1138782319,9781138782310
Group Dynamics in Recreation and Leisure: Creating Conscious Groups Through an Experiential Approach,0736062874,8580000744491
Managing Risk in Sport and Recreation: The Essential Guide for Loss Prevention (Book & CD-ROM),073606933X,9780736069335
"Sport and Public Policy: Social, Political, and Economic Perspectives",0736058710,9780736058711
Welding (2nd Edition),0134016343,9780134016344
Construction Technology: Trainee Guide (4th Edition),0134130391,9780134130392
Electrical Level 1 Trainee Guide (9th Edition),0134738209,9780134738208
Fundamentals of Building Construction: Materials and Methods,1118138910,9781118138915
Residential Land Development Practices: A Textbook on Developing Land into Finished Lots.,0784409676,9780784409671
Core Curriculum Trainee Guide (5th Edition),0134130987,9780134130989
Surveying Fundamentals and Practices (7th Edition) (What's New in Trades & Technology),0134414438,9780134414430
"Architecture: From Prehistory to Postmodernity, Reprint (2nd Edition)",0131830651,9780131830653
"Schaum's Outline of Electric Circuits, 6th edition (Schaum's Outlines)",0071830456,9780071830454
College Reading: The Science and Strategies of Expert Readers (MindTap Course List),1111350019,9781111350017
"Schaum's Outline of Electromagnetics, 4th Edition (Schaum's Outlines)",0071831479,9780071831475
Research Writing Simplified: A Documentation Guide (8th Edition),0321953487,9780321953483
GEN COMBO PRINCIPLES OF ATHLETIC TRAINING; CONNECT ACCESS CARD,1259916529,9781259916526
Therapeutic Medications in Athletic Training - 2nd Edition,0736068775,9780736068772
Emergency Management for Sport and Physical Activity,1284022161,9781284022162
Sports Medicine Essentials: Core Concepts in Athletic Training & Fitness Instruction,1401861857,9781401861858
Old School Boxing Fitness: How to Train Like a Champ,1620876094,8601418126126
Aircraft Inspection and Repair,1602399506,9781602399501
The Euthanasia/Assisted-Suicide Debate (Historical Guides to Controversial Issues in America),0313341877,9780313341878
Death and Dying (Opposing Viewpoints),0737712236,9780737712230
Cognitive Behavioural Prevention of Suicide in Psychosis: A treatment manual,0415658705,9780415658706
Problematic Behaviors During Adolescence,0072316853,9780072316858
Someone to Talk to: The Story of Chad Varah and the Samaritans (Faith in Action),1851752625,9781851752621
"Lab Manual for Whitman/Johnson/Tomczyk/Silberstein's Refrigeration and Air Conditioning Technology, 7th",1111644489,9781111644482
HVAC Level 4 Trainee Guide (4th Edition),0133757196,9780133757194
HVACR 101 (Enhance Your HVAC Skills!),141806663X,9781418066635
TechOne: Automotive Heating and Air Conditioning,1401839894,9781401839895
Fluid Power with Applications (6th Edition),0130608998,9780130608994
Principles of Magnetohydrodynamics: With Applications to Laboratory and Astrophysical Plasmas,0521626072,9780521626071
Berkeley Physics Course: Electricity and Magnetism v. 2,0070664951,9780070664951
Introduction to the Theory of Ferromagnetism (International Series of Monographs on Physics),0198508093,9780198508090
LECTURE NOTES ON ELECTRON CORRELATION AND MAGNETISM (Series in Modern Condensed Matter Physics),9810224745,9789810224745
Physics of Ferromagnetism (International Series of Monographs on Physics),0199564817,9780199564811
Ideal MHD,1107006252,9781107006256
Frustrated Spin Systems,9814440736,9789814440738
Fundamentals of Magnetism,3540311505,9783540311508
The Essential Guide to Becoming a Master Student (MindTap Course List),1337556351,9781337556354
Learning Group Leadership: An Experiential Approach,1452256683,9781452256689
Full Spectrum Supervision: Who You Are Is How You Supervise,1908746998,9781908746993
"Food, Cuisine, And Cultural Competency For Culinary, Hospitality, And Nutrition Professionals",0763759651,9780763759650
"Intergroup Dialogue: Deliberative Democracy in School, College, Community, and Workplace",0472067826,9780472067824
How to Study in College,1133960782,9781133960782
Straights: Heterosexuality in Post-Closeted Culture,0814764592,9780814764596
"The Story of Sexual Identity: Narrative Perspectives on the Gay and Lesbian Life Course (Sexuality, Identity, and Society)",0195326784,9780195326789
Gender Circuits: Bodies and Identities in a Technological Age (Sociology Re-Wired),0415996961,9780415996969
The Culture of Queers,0415223768,9780415223768
Counseling LGBTI Clients,1412987180,9781412987189
Slaves to Fashion: Black Dandyism and the Styling of Black Diasporic Identity,0822346036,9780822346036
"Lesbian, Gay, Bisexual, Trans and Queer Psychology: An Introduction",0521876664,9780521876667
"Queer TV: Theories, Histories, Politics",0415450462,9780415450461
Space Planning for Commercial Office Interiors,1563679051,9781563679056
Lighting Design Basics,0470474270,9780470474273
Manual Drafting for Interiors,0470879408,9780470879405
"Revealing Architectural Design: Methods, Frameworks and Tools",0415639026,9780415639026
Photoshop for Interior Designers: A Nonverbal Communication,1609015444,9781609015442
Interior Design and Decoration,0131944045,9780131944046
Lifespan Development: Infancy Through Adulthood (PSY 232 Developmental Psychology),0618721568,9780618721566
Principles of Electronics,0130344060,9780130344069
Map Use & Analysis,0073037486,9780073037486
Counseling Today: Foundations of Professional Identity (2nd Edition) (Merrill Counseling),0134816420,9780134816425
"Installing Football's Wishbone T Attack,",0134677129,9780134677125
Stalin (Profiles in Power),0582784794,9780582784796
Ice Cream,1461460956,9781461460954
The Fairchild Books Dictionary of Fashion,1609014898,9781609014896
Fashion Retailing: From Managing to Merchandising (Basics Fashion Management),2940496234,9782940496235
Fashion Thinking: Creative Approaches to the Design Process (Required Reading Range),2940411719,9782940411719
Dressed: A Century of Hollywood Costume Design,0060816503,8601410132750
"The Visible Self: Global Perspectives on Dress, Culture, and Society",1563676427,9781563676420
Embedded C Programming: Techniques and Applications of C and PIC MCUS,0128013141,9780128013144
PRE-ALGEBRA STUDENT WORKBOOK,0785435573,9780785435570
Holt McDougal Coordinate Algebra: Common Core GPS Student Edition 2014,0547867646,9780547867649
"Developing Skills in Algebra One, Book B",0866512225,9780866512220
"Algebra and Trigonometry Structure and Method, Book 2 (Teachers Edition)",0395585376,9780395585375
ATM Networks,0130936014,0076092010999
Robocop Vs. The Terminator,1616550082,9781616550080
A Practical Companion to Ethics,019973058X,9780199730582
Taking Sides: Clashing Views on Bioethical Issues,1259873404,9781259873409
Global Ethics: An Introduction,1844652823,9781844652822
The Right Thing To Do: Basic Readings in Moral Philosophy,0078038235,9780078038235
Ethics: Selections from Classical and Contemporary Writers,053845282X,9780538452823
Supportive care for the person with dementia,0199554137,9780199554133
Palliative Care Nursing: Quality Care to the End of Life,0826113842,9780826113849
Consoling Ghosts: Stories of Medicine and Mourning from Southeast Asians in Exile,0816687188,9780816687183
"The Architecture of Computer Hardware, Systems Software, & Networking: An Information Technology Approach",0471715425,9780471715429
CompTIA Network+ N10-006 Exam Cram (5th Edition),078975410X,8601422003895
Computer Networking: A Top-Down Approach (5th Edition),0136079679,9780136079675
Applied Networking Labs (2nd Edition),0133545180,9780133545180
Computer Networks and Internets (6th Edition),0133587932,9780133587937
Guide to TCP/IP: IPv6 and IPv4 (MindTap Course List),1305946952,9781305946958
Psychology: An Introduction,0078035163,9780078035166
Shakespeare's King Lear (Cliffs Notes),0822000415,9780822000419
The Lord of the Rings and The Hobbit (Cliffs Notes),0822012863,9780822012863
Critical Thinking Skills: Developing Effective Analysis and Argument (Palgrave Study Skills),0230285295,8601400017395
New Insight into IELTS Student's Book with Answers (Insights),0521680891,9780521680899
Machiavelli's The Prince (Cliffs Notes),0822010933,0049086010930
McGraw-Hill Education Preparation for the TASC Test 2nd Edition: The Official Guide to the Test (Mcgraw Hill's Tasc),0071843876,9780071843874
The Complete Idiot's Guide to College Biology,1592578489,9781592578481
The New Broadway Song Companion: An Annotated Guide to Musical Theatre Literature by Voice Type and Song Style,0810869438,9780810869431
Modern Jazz Voicings: Arranging for Small and Medium Ensembles,0634014439,0073999996715
AP® U.S. History Premium Edition Flashcard Book w/ CD (Advanced Placement (AP) Test Preparation),0738605034,9780738605036
The Marketplace of Revolution: How Consumer Politics Shaped American Independence,019518131X,9780195181319
Resilient Cultures: America's Native Peoples Confront European Colonialization 1500-1800,020569358X,9780205693580
The Caribbean: A Brief History,1780936028,9781780936024
Routledge Intensive Dutch Course (Routledge Intensive Language Courses),0415261910,9780415261913
Textbook of Syrian Semitic Inscriptions: Volume 1: Hebrew and Moabite Inscriptions,0198131593,9780198131595
"Integrated Chinese: Level 1, Part 2 (Textbook: Traditional Characters) (English and Mandarin Chinese Edition)",0887276725,9780887276729
Jenney's First Year Latin,020508723X,9780205087235
Rasskaz-Sensatsiya (The Story Sensation): for learners of the Russian language (and not only for Guadeloupeans!) (Unconventional Russian Language Textbooks (Russian Readers)) (Russian Edition),148121621X,9781481216210
"Ethics in Action (Workbook With DVD and CourseMate, 1 term (6 months) Printed Access Card)",1285850335,9781285850337
En Espanol: Level 2 Mas Practica Cuaderno with Lesson Review Bookmarks (Spanish Edition),0618661441,9780618661442
Fundamental Spanish,1553957806,9781553957805
REALIDADES 2014 LEVELED VOCABULARY AND GRAMMAR WORKBOOK LEVEL 3,0133225739,9780133225730
"Park and Recreation Professional's Handbook With Online Resource, The",073608259X,9780736082594
Forest Management and Planning,0128094761,9780128094761
Management of Park and Recreation Agencies,0983049300,9780983049302
Human Resource Management for Golf Course Superintendents,1575040387,9781575040387
Welding Level 1 Trainee Guide (5th Edition),0134163117,9780134163116
"Building Construction: Principles, Materials, and Systems (3rd Edition) (What's New in Trades & Technology)",0134454170,9780134454177
"Motivation and Self-Regulated Learning: Theory, Research, and Applications",0805858989,9780805858983
Biology: Today and Tomorrow without Physiology,0495109185,9780495109181
Surviving Your Dissertation: A Comprehensive Guide to Content and Process,1412916798,9781412916790
Teaching Mathematics to All Children: Designing and Adapting Instruction to Meet the Needs of Diverse Learners (2nd Edition),0131175742,9780131175747
Academic Writing: A Handbook for International Students,0415595819,9780415595810
Schaums Easy Outline of Basic Electricity Revised (Schaum's Easy Outlines),0071780688,9780071780681
The Call to Write,1439086141,9781439086148
The Social Science Jargon Buster: The Key Terms You Need to Know,1412921775,9781412921770
Academic Writing: A Handbook for International Students,1138778508,9781138778504
NEW MyLab Psychology with Pearson eText -- Valuepack Access Card,0205206514,9780205206513
Athletic and Sport Issues in Musculoskeletal Rehabilitation,1416022643,9781416022640
Sports Medicine in the Pediatric Office: A Multimedia Case-Based Text with Video,1610021223,9781610021227
The Athletic Trainer's Guide to Psychosocial Intervention and Referral,1556427336,9781556427336
Musculoskeletal Trauma:Implications for Sports Injury Management,0736038795,9780736038799
Biomedical Acupuncture for Sports and Trauma Rehabilitation: Dry Needling Techniques,1437709273,9781437709278
Suicide Prevention Audio Tapes,1559590025,9781559590020
"Heating, Ventilation, and Air Conditioning: A Residential and Light Commercial Text & Lab Book (Heating, Ventilating & Air Conditioning)",1401884725,9781401884727
Commercial Refrigeration for Air Conditioning Technicians,130550643X,9781305506435
Pipefitters Handbook: Second Expanded Edition,1614273294,9781614273295
Heat Pump Technology (3rd Edition),0130339652,9780130339652
"Testing and Balancing HVAC Air and Water Systems, Fifth Edition",1482255677,9781482255676
Refrigeration and Air Conditioning (McGraw-Hill Series in Mechanical Engineering),0070616191,9780070616196
"Heating, Cooling, Lighting: Sustainable Design Methods for Architects",0470048093,9780470048092
The Trade Technician’s Soft Skills Manual,1111313814,9781111313814
Elements of Electromagnetics (The Oxford Series in Electrical and Computer Engineering),019932140X,9780199321407
Electromagnetic and Optical Pulse Propagation 1: Spectral Representations in Temporally Dispersive Media (Springer Series in Optical Sciences),1441922385,9781441922380
References for III/7 / Literaturverzeichnis für III/7 (Landolt-Börnstein: Numerical Data and Functional Relationships in Science and Technology - New Series) (Volume 7) (English and German Edition),3540065415,9783540065418
Introduction to Magnetism and Magnetic Materials,0412386305,9780412386305
Theory of Itinerant Electron Magnetism (International Series of Monographs on Physics),0198500289,9780198500285
Keys to Effective Learning: Study Skills and Habits for Success (6th Edition),0137007507,9780137007509
"Everybody Needs Training: Proven Success Secrets for the Professional Fitness Trainerâ ""how to Get More Clients, Make More Money, Change More Lives",0938045733,9780938045731
7 Measures of Success: What Remarkable Associations Do That Others Don't-Revised and Updated Edition,0880343419,8601420124288
Your Complete Guide to College Success,1433812967,9781433812965
Orientation to College: A Reader (Wadsworth College Success),0534599583,9780534599584
"The Bigs: The Secrets Nobody Tells Students and Young Professionals About How to Find a Great Job, Do a Great Job, Be a Leader, Start a Business, Stay Out of Trouble, and Live A Happy Life",1118917022,9781118917022
"Take Two: Skill-Building Skits You Have Time to Do! Active, Engaging Ways to Teach Social Skills",1934490563,9781934490563
Curriculum Development in the Postmodern Era (Critical Education Practice),0815319266,9780815319269
Homosexuality and the Mental Health Professions: The Impact of Bias (GAP REPORT (GROUP FOR THE ADVANCEMENT OF PSYCHIATRY)),0881633186,9780881633184
Becoming a Woman: A Biography of Christine Jorgensen (Sexual Minorities in Historical Context),1560236663,9781560236665
"Queer French: Globalization, Language, and Sexual Citizenship in France",0754647951,9780754647959
Bisexual Women: Friendship and Social Organization,1560237031,9781560237037
Political Institutions and Lesbian and Gay Rights in the United States and Canada (Routledge Studies in North American Politics),0415988713,9780415988711
Drafting and Visual Presentation for Interior Designers (Fashion Series),013506421X,9780135064214
