title,isbn10,isbn13
Nutrition with Online Testing Voucher and Exam Prep -- Access Card Package (2nd Edition),0133086585,9780133086584
A Multiliteracies Framework for Collegiate Foreign Language Teaching (Theory and Practice in Second Language Classroom Instruction),0205954049,9780205954049
Intensive Basic Latin: A Grammar and Workbook (Grammar Workbooks),0415723647,9780415723640
"Student Activities Manual for Motyl-Mudretzkyj/Späinghaus' Anders gedacht: Text and Context in the German-Speaking World, 3rd",1133942695,9781133942696
Die Deutschen (World Languages),0030210399,9780030210396
Teacher Language Awareness (Cambridge Language Teaching Library),0521530199,9780521530194
'O si Manu a Ali'i,0824825950,9780824825959
Learn to Read Greek: Workbook Part 1,0300115911,9780300115918
Filter Synthesis Using Genesys S/Filter (Artech House Microwave Library (Hardcover)),1608078027,9781608078028
Electricity and Electronics: A Survey (5th Edition),0130195642,9780130195647
Troubleshooting and Repairing Commercial Electrical Equipment,0071810307,9780071810302
Illustrated Guide to the NEC (Illustrated Guide to the National Electrical Code (NEC)),1435498135,9781435498136
Modern Residential Wiring,1605255823,9781605255828
Electrical Safety,1435481852,9781435481855
Electrical Theory for Renewable Energy (Go Green with Renewable Energy Resources),113312755X,9781133127550
Journeyman Electrician’s Review,1439059446,9781439059449
"Electronics Fundamentals: Circuits, Devices & Applications with Lab Manual (8th Edition)",0136125123,9780136125129
Understanding Motor Controls,1401890164,9781401890162
"Electrical Level 3 Trainee Guide 2008 NEC, Paperback",0136044719,9780136044710
"Electrical Level 4 Trainee Guide, 2011 NEC Revision, Paperback (7th Edition) (Contren Learning)",0132569566,9780132569569
"The 8088 and 8086 Microprocessors: Programming, Interfacing, Software, Hardware, and Applications (4th Edition)",0130930814,9780130930811
Organic Chemistry I (Cliffs Quick Review),0822053268,9780822053262
"Living Language Russian, Essential Edition: Beginner course, including coursebook, 3 audio CDs, and free online learning",0307972097,9780307972095
CliffsNotes on Fowles' The French Lieutenant's Woman,0822004992,9780822004998
CliffsNotes on Shaw's Pygmalion and Arms and The Man,0822011034,0049086011036
Analysis & Study Guide: Dr Jekyll and Mr Hyde: Complete text & integrated study guide (Creative Study Guide Editions) (Volume 2),1494767910,9781494767914
Kaplan Medical Internal Medicine Question Book,1607141264,9781607141266
Cyrano de Bergerac (Cliffs Notes),0822003465,0785555009622
CliffsNotes on Tan's The Joy Luck Club (Cliffsnotes Literature Guides),0822006855,9780822006855
"Out of Many: A History of the American People, Volume 1 (7th Edition)",0205011918,9780205011919
10 Real LSATs Grouped by Question Type,1937707784,9781937707781
Don Quixote (Cliffs Notes),0822004151,9780822004158
The Ethics of Health Care Rationing: An Introduction,0415521181,9780415521185
Altruism in Humans,0195341066,9780195341065
"Leveraging Lean in the Emergency Department: Creating a Cost Effective, Standardized, High Quality, Patient-Focused Operation",1482237318,9781482237313
Euripides' Electra and Medea,0822004240,9780822004240
CAPM In Depth: Certified Associate in Project Management Study Guide for the CAPM Exam,1435455347,9781435455344
Ethical Issues in Behavioral Research: Basic and Applied Perspectives,1405134399,9781405134392
Oxford International Primary Science Stage 4: Age 8-9 Student Workbook 4,0198394802,9780198394808
Sur le vif: Niveau intermediaire (World Languages),1133311261,9781133311263
Academic Encounters Level 2 Teacher's Manual Reading and Writing: American Studies,1107627222,9781107627222
The Psychology of Attitude Change and Social Influence,0070728771,9780070728776
Statistics for the Behavioral and Social Sciences: A Brief course (3rd Edition),0131505084,9780131505087
Intermediate Hindi Reader (Hindi and English Edition),087725351X,9780877253518
Medical Equipment Management (Series in Medical Physics and Biomedical Engineering),1420099582,9781420099584
Dynamic Capacity Management for Healthcare: Advanced Methods and Tools for Optimization,1439819750,9781439819753
Events Feasibility and Development: From Strategy to Operations (Events Management),0750666404,9780750666404
Forest Ranger(Passbooks) (Career Examination Series : C-281),0837302811,9780837302812
"An Integrative Approach to Leader Development: Connecting Adult Development, Identity, and Expertise",0415964636,9780415964630
Primate Psychology,0674018478,9780674018471
Developmental Disorders of Language Learning and Cognition,0631206124,9780631206125
Doing and Being: Selected Readings in Moral Philosophy,002348585X,9780023485855
Mind and Cognition: An Anthology,1405157852,9781405157858
Introduction to Ethical Theories: A Procedural Approach,1478606703,9781478606703
"The Moral Leader: Challenges, Tools and Insights",0415400643,9780415400640
Basic Moral Philosophy,0495007978,9780495007975
Ethical Marketing,0131848143,9780131848146
"Intermediate French Workbook: Level II (Workbook Series, Level 2) (French Edition)",2831560101,0052106060105
10 Real LSATs Grouped by Question Type: Manhattan LSAT Practice Book (Manhattan LSAT Practice Books),1937707369,9781937707361
Student Workbook to Use With Discover Romanian: An Introduction to the Language and Culture,0814206875,9780814206874
Business and Management Workbook for the International Baccalalureate,1876659939,9781876659936
"Workbook for Smith/Joyce's Plumbing Technology: Design and Installation, 4th",141805092X,9781418050924
Ventures Level 1 Student's Book with Audio CD,110769289X,9781107692893
En avant! Beginning French (Student Edition) - Standalone book,0073386464,9780073386461
Elements of Success Student Book 3,0194028267,9780194028264
"Banal Nationalism (Theory, Culture and Society)",0803975252,9780803975255
Understanding Sexuality Research,0534509584,9780534509583
The Psychology of Attitudes and Attitude Change,1446272265,9781446272268
The Psychology of Happiness: A Good Human Life,0521138671,9780521138673
Individual Differences and Personality,0128098457,9780128098455
Close Relationships: Key Readings (Key Readings in Social Psychology),0863775969,9780863775963
Looking for Gold,3856307184,9783856307189
Honor and Slavery,0691017190,9780691017198
"History of South Dakota, 4th Edition, Revised",0971517134,9780971517134
"Butch Queens Up in Pumps: Gender, Performance, and Ballroom Culture in Detroit (Triangulations: Lesbian/Gay/Queer Theater/Drama/Performance)",0472051962,9780472051960
The Urban Underworld in Late Nineteenth-Century New York: The Autobiography of George Appo: With Related Documents (The Bedford Series in History and Culture),0312607628,9780312607623
Broadway: The American Musical,1423491033,0884088476106
Advanced French Grammar,0521484251,9780521484251
Using Russian Vocabulary (Using (Cambridge)),0521612365,9780521612364
Repaso:  A Spanish Grammar Review Worktext,0073534366,9780073534367
Polish: A Comprehensive Grammar (Routledge Comprehensive Grammars),0415475414,9780415475419
Becoming a Translator: An Introduction to the Theory and Practice of Translation,0415615909,9780415615907
"Spanish Translated Anatomy & Physiology Reference for Beauty and Wellness Professionals, Spiral Bound Version",1111642125,9781111642129
Theory of Mind: Beyond the Preschool Years,1848729286,9781848729285
Do Apes Read Minds?: Toward a New Folk Psychology (The MIT Press),0262017555,9780262017558
Analyzing Moral Issues,0073535745,9780073535746
Jenseits von Gut und Böse/Beyond Good and Evil (German/English Bilingual Text) (German Edition),1909669237,9781909669239
Ethics for Modern Life,0312157614,9780312157616
Unfit for the Future: The Need for Moral Enhancement (Uehiro Series in Practical Ethics),0198707924,9780198707929
On the Human Condition (Thinking in Action),0415327962,9780415327961
Philosophy and Choice: Selected Readings from Around the World with Free Philosophy PowerWeb,0072840633,9780072840636
Ethics and Emerging Technologies,0230367038,9780230367036
Environmental Ethics,0538452846,9780538452847
Sterling Test Prep MCAT Practice Tests: Chemical & Physical Foundations,0989292509,9780989292504
Workbook for Machine Tool Practices,0131721038,9780131721036
DIS-MOI! PRACTICE SHEET WORKBOOK 1990C LEVEL 1,067335072X,9780673350725
French Experience 1,0563472618,9780563472612
Chapman & Hall’s Complete Fundamentals of Engineering Exam Review Workbook (Chapman & Hall Professional Engineer Workbook Series),0412149613,9780412149610
Tom and Ricky Mystery Series- Set 1(Teacher's Edition): Reproducable Activity Workbook (High Noon S.),087879509X,9780878795093
Workbook with Lab Manual for Silberstin's Residential Construction Academy: HVAC (Residential Construction Academy Series),1428323694,9781428323698
Skill Builders,0538644559,9780538644556
"Kalima wa Nagham: A Textbook for Teaching Arabic, Volume 1 (English and Arabic Edition)",0292757751,9780292757752
Yookoso! Continuing with Contemporary Japanese Student Edition with Online Learning Center Bind-In Card,0072974966,9780072974966
Composición: Proceso y síntesis,0073513148,9780073513140
"Student Activities Manual for Golosa: A Basic Course in Russian, Book One",0205748767,9780205748761
Reading and Writing the Lakota Language,0874805724,9780874805727
The Group in Society,1412924685,9781412924689
Applying Emotional Intelligence: A Practitioner's Guide,1841694622,9781841694627
"Essentials of Human Behavior: Integrating Person, Environment, and the Life Course",1412998840,9781412998840
Savoring: A New Model of Positive Experience,0805851208,9780805851205
The Oxford Handbook of Diversity and Work (Oxford Library of Psychology),0199388032,9780199388035
"The Power of Human Imagination: New Methods in Psychotherapy (Emotions, Personality, and Psychotherapy)",0306311402,9780306311406
"Implementation: How Great Expectations in Washington Are Dashed in Oakland; Or, Why It's Amazing that Federal Programs Work at All, This Being a Saga ... Morals on a Foundation (Oakland Project)",0520053311,0884960151190
Mr. Putin: Operative in the Kremlin (Geopolitics in the 21st Century),0815726171,9780815726173
Shadow Tribe: The Making of Columbia River Indian Identity (Emil and Kathleen Sick Book Series in Western History and Biography),0295990201,9780295990200
"Oggi In Italia, Enhanced (World Languages)",1285874404,9781285874401
Hair Care Product and Ingredients Dictionary (MILADY'S HAIR CARE PRODUCT INGREDIENTS DICTIONARY),1562539191,9781562539191
mHealth: From Smartphones to Smart Systems (HIMSS Book Series),0984457763,9780984457762
Cases in Hospitality and Tourism Management,0131700758,9780131700758
Service Management: An Integrated Approach,027373203X,9780273732037
Neuroscience of Cognitive Development: The Role of Experience and the Developing Brain,0471745863,9780471745860
New Immigrants in the United States: Readings for Second Language Educators (Cambridge Language Teaching Library),0521667984,9780521667982
En Camino (Level 1B),0030659566,9780030659560
Student Activity Manual for Rusch/Dominguez/Caycedo Garner's Fuentes: Conversacion y gramatica,0495898686,9780495898689
Cleveland: A Metropolitan  Reader,087338492X,9780873384926
A Nation Under Our Feet: Black Political Struggles in the Rural South from Slavery to the Great Migration,067401765X,9780674017658
Routledge Intensive Italian Workbook (Routledge Intensive Language Courses),0415240794,9780415240796
"Reading Old English: A Primer and First Reader, Revised Edition",1933202742,9781933202747
Standard Arabic: An Elementary-Intermediate Course,0521774659,9780521774659
Lucan: Bello Civili I (Latin Texts) (Bk. 1),1853993573,9781853993572
Livy: Book I (Latin Texts) (Bk. 1),0862922968,9780862922962
De lector a escritor: El desarrollo de la comunicacion escrita (World Languages),0838416500,9780838416501
A Spanish Learning Grammar (Essential Language Grammars) (Volume 2) (Spanish Edition),1444157337,9781444157338
Pacific Languages: An Introduction,0824818989,9780824818982
"Hospitals & Healthcare Organizations: Management Strategies, Operational Techniques, Tools, Templates and Case Studies",1439879907,9781439879900
"Handbook of Health Economics, Volume 1B",0444504710,9780444504715
"Successful Collaboration in Healthcare: A Guide for Physicians, Nurses and Clinical Documentation Specialists",1439812926,9781439812921
Hospitality Supervisor's Survival Kit,0130498467,9780130498465
"The Consuming Geographies of Food: Diet, Food Deserts and Obesity (Routledge Studies of Gastronomy, Food and Drink)",0415818702,9780415818704
Managing Services: Challenges and Innovation,019969608X,9780199696086
"The Economics of Information: A Guide to Economic and Cost-Benefit Analysis for Information Professionals, 2nd Edition (Library and Information Science Text Series)",1563088169,9781563088162
Colloquial Dutch: A Complete Language Course,1138124311,9781138124318
Electronics Technology Fundamentals - Conventional Flow (2nd Edition),0131190849,9780131190849
Introductory Electronic Devices and Circuits: Electron Flow Version (7th Edition),0131716395,9780131716391
Practical Power Distribution for Industry (Practical Professional Books from Elsevier),0750663960,9780750663960
Electrical Grounding and Bonding,1337102008,9781337102001
The Electricians Green Handbook (Go Green with Renewable Energy Resources),1111129800,9781111129804
Industrial Electronics,0023730234,9780023730238
Electrical Theory DC Interactive DVD (1-4),1439059888,9781439059883
"Electrical Installation Calculations: Advanced, 8th ed",0415810035,8601300262918
Electrical Construction and Maintenance Techniques,0132471566,9780132471565
"Tools for Structured and Object-Oriented Design: An Introduction to Programming Logic, Sixth Edition",0130494984,9780130494986
"Electricity 4: AC/DC Motors, Controls, and Maintenance",1435400313,9781435400313
Guide to Telecommunications Cable Splicing,1428360913,9781428360914
Glaser on Health Care IT: Perspectives from the Decade that Defined Health Care Information Technology (HIMSS Book Series),1498768520,9781498768528
"Service Management: Operations, Strategy, Information Technology",0071289275,9780071289276
"Service Management: Operations, Strategy, and Information Technology with Student CD-Rom Mandatory Package",0072424192,9780072424195
Corrective Haircoloring: A Hands-On Approach,1562530836,9781562530839
The Lean Healthcare Dictionary: An Illustrated Guide to Using the Language of Lean Management in Healthcare,1482232898,9781482232899
"Lodging and Food Service Industry with Answer Sheet, The (AHLEI) (7th Edition) (AHLEI - Introduction to Hospitality)",0133097110,9780133097115
Couchsurfing Cosmopolitanisms: Can Tourism Make a Better World? (Culture and Social Practice),383762255X,9783837622553
Issues in Cultural Tourism Studies,0415467128,9780415467124
Workbook for Milady's Standard Nail Technology,1435497643,9781435497641
English for Hospitality and Foodservice,0130484075,9780130484079
Technology Strategies for the Hospitality Industry,0130305049,9780130305046
Information Security in Healthcare: Managing Risk (HIMSS Book Series),0982107021,9780982107027
Around the Patient Bed: Human Factors and Safety in Health Care (Human Factors and Ergonomics),1466573627,9781466573628
Cases in Hospitality Strategy and Policy,0471240125,9780471240129
Principles of Service Marketing and Management,013676875X,9780136768753
Healthcare Transformation: A Guide for the Hospital Board Member,1439805067,9781439805060
Literacy Instruction for Students who are Deaf and Hard of Hearing (Professional Perspectives On Deafness: Evidence and Applications),0199838550,9780199838554
Basic Engineering Circuit Analysis,0470128690,9780470128695
CliffsNotes on Franklin's Autobiography of Benjamin Franklin,0822002167,9780822002161
Palabra por Palabra / Verbatim: New Advanced Spanish Vocabulary (Spanish Edition) (Spanish and English Edition),1444110012,9781444110012
Doctor Faustus (Cliffs Notes),0822004062,0049086004069
GRE Mathematics (GRE Test Preparation),0878916377,9780878916375
Certified Management Accountant Exam Secrets Study Guide: CMA Test Review for the Certified Management Accountant Exam,1609714083,9781609714086
Locksmith(Passbooks) (Career Examination Passbooks),0837313481,9780837313481
"Agamemnon, The Choephori & The Eumenides (Cliffs Notes)",0822001284,0049086001280
The Psychology of Prayer: A Scientific Approach,146250695X,9781462506958
Human Behavior in Global Perspective: An Introduction to Cross Cultural Psychology (2nd Edition),0205188613,9780205188611
Social Psychology,0335240992,9780335240999
"Sensation, Perception and Action: An Evolutionary Perspective",0230552676,8601406123274
Critical Issues in Clinical and Health Psychology,1849207623,9781849207621
Q Methodology (Quantitative Applications in the Social Sciences),1452242194,9781452242194
Persuasion in Society,0415965144,9780415965149
Understanding Social Psychology Across Cultures: Engaging with Others in a Changing World,1446267113,9781446267110
Schaum's Outline of Analytical Chemistry,0070237956,9780070237957
Stoker's Dracula (Cliffs Notes),0822004178,9780822004172
Tom Jones (Cliffs Notes),0822012936,9780822012931
Aristotle's Ethics (Cliffs Notes),0822008890,0785555010819
CliffsNotes on Orwell's 1984,0822008998,9780822008996
"A Postmodern Psychology of Asian Americans: Creating Knowledge of a Racial Minority (SUNY series, Alternatives in Psychology)",0791452964,9780791452967
"Attitudes, Personality and Behavior (2nd Edition)",0335217036,9780335217038
Detect Deceit: How to Become a Human Lie Detector in Under 60 Minutes,1616086467,9781616086466
Identity and Cultural Diversity: What social psychology can teach us,1848721218,9781848721210
Dos mundos en breve Student Edition,0073213411,9780073213415
"Henry Hudson and the Algonquins of New York: Native American Prophecy & European Discovery, 1609",1571782222,9781571782229
Cambridge IGCSE & International Certificate Spanish Foreign Language (Cambridge IGCSE Modern Foreign Languages) (Spanish Edition),1444181009,9781444181005
Matrices (School Mathematics Project 16-19),0521426510,9780521426510
Skillbuilder Workbook for Interpersonal Communication: Relating to Others,0205524524,9780205524525
Acquiring Clinical Judgment: : A Workbook / Casebook to Accompany - Theory and Design in Counseling and Psychotherapy,0618191437,9780618191437
An Introduction to Literary Chinese: Revised Edition (Harvard East Asian Monographs),0674017269,9780674017269
Intermediate Dutch: A Grammar and Workbook (Grammar Workbooks),0415774446,9780415774444
A Greek Prose Course: Unit 2: Philosophy,185399538X,9781853995385
Developing Writing Skills in Arabic (English and Arabic Edition),0415588138,9780415588133
Thinking Arabic Translation: A Course in Translation Method: Arabic to English (Thinking Translation),0415705630,9780415705639
The Leftmost City: Power and Progressive Politics in Santa Cruz,0813344387,9780813344386
Bloodstoppers and Bearwalkers: Folk Traditions of Michigan’s Upper Peninsula,0299227146,9780299227142
Land of Amber Waters: The History of Brewing in Minnesota,0816652732,9780816652730
The Osage (Indians of North America),1555467229,9781555467227
The American South: A History (Volume 2),1442262311,9781442262317
Dark Side of Fortune: Triumph and Scandal in the Life of Oil Tycoon Edward L. Doheny,0520202929,9780520202924
North Carolina: The Years Before Man : A Geologic History,0890894000,9780890894002
Ethical Leadership (Work and Organizational Psychology),0335216994,9780335216994
Steck-Vaughn Head for Home: Student Edition Grades 5 - 8 Fractions,0739885308,9780739885307
CIM Coursebook 03/04 Marketing in Practice (CIM Workbooks 2003/04 Editions),0750659564,9780750659567
Personalities Theories Workbook,0155068164,9780155068162
Reference Work in School Library Media Centers,0810830981,9780810830981
Arco Sat Math Workbook (PETERSON'S MATH EXERCISES FOR THE SAT),0768906156,9780768906158
Grade Aid Workbook with Practice Tests,0205479049,9780205479047
"Read and Speak Greek for Beginners with Audio CD, 2nd Edition (Read and Speak Languages for Beginners)",007176643X,9780071766432
Rond-Point: une perspective actionnelle (2nd Edition),0205782779,9780205782772
Civilizacion y cultura de España (5th Edition),0131946382,9780131946385
An Introduction to Japanese Linguistics,1405110651,9781405110655
Intermediate Irish: A Grammar and Workbook (Grammar Workbooks),0415410428,9780415410427
Student Activities Manual for Merlonghi/Merlonghi/Tursi/O'Connor's Oggi In Italia,049590032X,9780495900320
Soluzioni: A Practical Grammar of Contemporary Italian (Routledge Concise Grammars) (Italian Edition),1138018481,9781138018488
Japanese for Professionals,1568364601,9781568364605
Thinking Spanish Translation: A Course in Translation Method: Spanish to English (Thinking Translation),0415481309,9780415481304
"Student Activities Manual for Dollenmayer/Hansen's Neue Horizonte, 8th",1133946178,9781133946175
Intermediate Spanish: A Grammar and Workbook (Grammar Workbooks),0415355028,9780415355025
Creating the Capacity for Attachment: Treating Addictions and the Alienated Self,0765702401,9780765702401
"A Pueblo Social History: Kinship, Sodality, and Community in the Northern Southwest (A School for Advanced Research Resident Scholar Book)",1938645103,9781938645105
The Artifacts of Pecos (Foundations of Archaeology),0971958777,9780971958777
Massachusetts Our Home,1586850598,9781586850593
At Nature's Edge: Frank Lloyd Wright's Artist Studio,0874808774,9780874808773
"The Forgotten Expedition, 1804–1805: The Louisiana Purchase Journals of Dunbar and Hunter",0807159077,9780807159071
"Street Scenes: Staging the Self in Immigrant New York, 1880–1924",0816645221,9780816645220
Loulu: The Hawaiian Palm,0824835670,9780824835675
Plants as Persons: A Philosophical Botany (SUNY series on Religion and the Environment),1438434286,9781438434285
Reading Ethics (Reading Philosophy),1405124733,9781405124737
"Metaethics, Normative Ethics, and Applied Ethics: Contemporary and Historical Readings",0534573843,9780534573843
Ethics and Anthropology: Ideas and Practice,0759121877,9780759121874
Philosophical Ethics: An Historical And Contemporary Introduction (Dimensions of Philosophy),0813378605,9780813378602
Applied Ethics: A Multicultural Approach (5th Edition),0205708080,9780205708086
The Continental Ethics Reader,0415943302,9780415943307
Let's Go Readers,0194369862,9780194369862
Letts KS1 Success Workbook: English SATs: Revision Workbook (Primary Success Workbooks),1843157438,9781843157434
SMP Interact Book 7T: for the Mathematics Framework (SMP Interact for the Framework),0521537975,9780521537971
Test Best On The Metropolitan Achievement Tests (Mat 7): Intermediate 3,0811496252,9780811496254
"Beginning Indonesian Through Self-Instruction, Book 2 [Lessons 1 - 15]",0877275300,9780877275305
Deux mondes (Student Edition),0073386456,9780073386454
Understanding Language: A Guide for Beginning Students of Greek and Latin,0813218667,9780813218663
Playing on the Mother-Ground: Cultural Routines for Children's Development (Culture and Human Development),1572302151,9781572302150
Computer Ethics: A Case-based Approach,0521709148,9780521709149
"Understanding Gregory Bateson: Mind, Beauty, and the Sacred Earth (SUNY series in Environmental Philosophy and Ethics)",0791474526,9780791474525
Ponto de Encontro: Portuguese as a World Language (2nd Edition),0205782760,9780205782765
Experience Spanish (Student Edition),0073534447,9780073534442
Interaction: Langue et culture (Book Only) (World Languages),1133311245,9781133311249
Ovid: Metamorphoses I (Bk.1) (English and Latin Edition),0862921449,9780862921446
Professional English in Use Medicine,0521682010,9780521682015
Sibling Relationships Across the Life Span,0306450259,9780306450259
In Vivo Optical Imaging of Brain Function (Frontiers in Neuroscience),1420076841,9781420076844
Digital Youth: The Role of Media in Development (Advancing Responsible Adolescent Development),1461427371,9781461427377
"Child Sexual Abuse: Disclosure, Delay, and Denial",0805863176,9780805863178
Toward a Global Idea of Race (Barrows Lectures),0816649200,9780816649204
Disputed Moral Issues: A Reader,0195388720,9780195388725
Resolving Ethical Dilemmas in Social Work Practice,0205290418,9780205290413
The Moral Life: An Introductory Reader in Ethics and Literature,0195396251,9780195396256
Ethics for Professionals in a Multicultural World,0131830937,9780131830936
Culturas de Espana (World Languages),1285053648,9781285053646
Longman Dictionary of American English (paperback with PIN) (5th Edition),1447948106,9781447948100
"Cuadros Student Text, Volume 1 of 4: Introductory Spanish (World Languages)",1111341141,9781111341145
Dabrowski's Theory of Positive Disintegration,0910707847,9780910707848
"Lesbian, Gay, and Bisexual Identities and Youth: Psychological Perspectives",0195119533,9780195119534
Nonlinear Dynamics: Techniques and Applications in Psychology,0805832009,9780805832006
Moral Development: Theory and Applications,0415821908,9780415821902
Workbook/Laboratory Manual to accompany Yookoso!: An Invitation to Contemporary Japanese,007249302X,9780072493023
Motor Learning in Practice: A Constraints-Led Approach,0415522404,9780415522403
Models Of Cognitive Development,0863778534,9780863778537
Electrician's Exam Prep,0763751189,9780763751180
Principles of Refrigeration (5th Edition),0130272701,9780130272706
Instrumentation and Measurement for Electronics Technicians (2nd Edition),0023430516,9780023430510
Electricity for the Trades,0073134317,9780073134314
Electric Motors and Control Systems,0073373818,9780073373812
